title,category,post_id
 Find A Quick Way To GRAPHIC,graphic,10260109
 How To Sell CRAFT,Craft,39550285
POLITICS An Incredibly Easy Method That Works For All,politics,935118791
5 Brilliant Ways To Use POLITICAL,political,151805043
 How To Make Your MATHEMATICS Look Amazing In 5 Days,Mathematics,995833095
 Avoid The Top 10 POLITICS Mistakes,politics,433588097
 3 Simple Tips For Using ZOOLOGY To Get Ahead Your Competition,zoology,521413892
 Is BUSINESS Worth [$] To You?,business,898144956
 Old School DANCE,dance,34602180
" If You Want To Be A Winner, Change Your BANKING Philosophy Now!",banking,948602251
MATHEMATICS: This Is What Professionals Do,Mathematics,585494516
 Why Most People Will Never Be Great At HR MANAGEMENT,HR management,13299671
 Now You Can Buy An App That is Really Made For ART,art,100629222
 52 Ways To Avoid POLITICS Burnout,politics,426531040
 5 Ways HR MANAGEMENT Will Help You Get More Business,HR management,851612722
 Is POLITICAL Worth [$] To You?,political,765479755
 How To Earn $398/Day Using BANKING,banking,208895964
 Want A Thriving Business? Focus On POLITICAL!,political,810951169
 What You Should Have Asked Your Teachers About DANCE,dance,744492207
 3 Things Everyone Knows About POLITICAL That You Don't,political,484235148
 10 Funny SCIENCE Quotes,science,990495089
 Best Make POLITICS You Will Read This Year (in 2015),politics,103046717
 5 Incredibly Useful MATHEMATICS Tips For Small Businesses,Mathematics,70771053
 How To Teach MATHEMATICS Better Than Anyone Else,Mathematics,310153243
 3 Ways Create Better MUSIC With The Help Of Your Dog,Music,710288276
 The Ugly Truth About DANCE,dance,722997112
 5 Incredibly Useful ART Tips For Small Businesses,art,906677663
 Why Ignoring OPERATING SYSTEM Will Cost You Time and Sales,operating system,911111302
"At Last, The Secret To POLITICAL Is Revealed",political,210693300
 Where Is The Best BUSINESS?,business,463840491
 Why Most MUSIC Fail,Music,84954837
 The Untapped Gold Mine Of FASHION DESIGN That Virtually No One Knows About,Fashion Design,487421485
 The Biggest Lie In OPERATING SYSTEM,operating system,540648911
MATHEMATICS And Love Have 4 Things In Common,Mathematics,650199136
BANKING: What A Mistake!,banking,147242106
PROGRAMMING Adventures,programming,133128287
 The Ultimate Secret Of POLITICAL,political,424494306
 Succeed With BANKING In 24 Hours,banking,930779281
 To People That Want To Start PAINTING But Are Affraid To Get Started,painting,588637446
 3 Ways To Master GRAPHIC Without Breaking A Sweat,graphic,212587612
 OMG! The Best POLITICS Ever!,politics,424300693
 What Can You Do About PHOTOGRAPHY Right Now,photography,885642411
 There’s Big Money In OPERATING SYSTEM,operating system,885710969
 What Can You Do To Save Your FASHION DESIGN From Destruction By Social Media?,Fashion Design,170986306
 The Untold Secret To Mastering ART In Just 3 Days,art,870450204
MATHEMATICS: Do You Really Need It? This Will Help You Decide!,Mathematics,399371824
 15 Unheard Ways To Achieve Greater POLITICS,politics,313988026
10 Best Practices For CRAFT,Craft,801717359
 Using 7 DANCE Strategies Like The Pros,dance,405414454
 How To Save Money with DANCE?,dance,298209599
 How To Make Your POLITICAL Look Like A Million Bucks,political,143900889
 What Make BUSINESS Don't Want You To Know,business,794811687
 Picture Your ART On Top. Read This And Make It So,art,947737161
 13 Myths About BANKING,banking,150780976
" If You Want To Be A Winner, Change Your DANCE Philosophy Now!",dance,164856878
" How We Improved Our OPERATING SYSTEM In One Week(Month, Day)",operating system,644307764
 Turn Your ART Into A High Performing Machine,art,438076886
" At Last, The Secret To DRAWING Is Revealed",drawing,585758422
A Surprising Tool To Help You SCIENCE,science,707052510
 Who Else Wants To Enjoy BANKING,banking,599838343
" In 10 Minutes, I'll Give You The Truth About PROGRAMMING",programming,889377567
PAINTING Works Only Under These Conditions,painting,111087643
 Have You Heard? DANCE Is Your Best Bet To Grow,dance,399910575
 How To Start DANCE With Less Than $100,dance,455070866
 Get Rid of ART Once and For All,art,426183370
ZOOLOGY Adventures,zoology,254721774
 Learn How To Start OPERATING SYSTEM,operating system,683747514
 Here Is A Method That Is Helping POLITICS,politics,11423192
 Who Else Wants To Enjoy DANCE,dance,505689676
 Open The Gates For HR MANAGEMENT By Using These Simple Tips,HR management,471532426
 Fall In Love With MUSIC,Music,146779002
 The Number One Reason You Should (Do) BUSINESS,business,768935044
 What You Should Have Asked Your Teachers About GST,GST,974764855
 Stop Wasting Time And Start MUSIC,Music,188793538
 Don't Be Fooled By GST,GST,198026754
 5 Things To Do Immediately About SCIENCE,science,893265893
 Do PHOTOGRAPHY Better Than Barack Obama,photography,96566346
 5 Easy Ways You Can Turn POLITICAL Into Success,political,361314218
 Can You Pass The SCIENCE Test?,science,299069665
 Everything You Wanted to Know About MUSIC and Were Afraid To Ask,Music,286075749
 Here Is A Quick Cure For PAINTING,painting,497142622
 The Ugly Truth About ZOOLOGY,zoology,552303411
 3 Ways You Can Reinvent MUSIC Without Looking Like An Amateur,Music,251845242
 What Can Instagramm Teach You About GST,GST,897673202
 Picture Your DRAWING On Top. Read This And Make It So,drawing,769151512
 15 Tips For BUSINESS Success,business,749396683
 The Ultimate Secret Of PHOTOGRAPHY,photography,858693164
 What Can You Do About DRAWING Right Now,drawing,466838718
 7 Rules About DANCE Meant To Be Broken,dance,13766583
 Sexy MUSIC,Music,900240811
 How To Turn Your PAINTING From Zero To Hero,painting,710409155
 How You Can (Do) CRAFT Almost Instantly,Craft,707556356
 A Guide To MUSIC At Any Age,Music,205207461
 How To Start A Business With PROGRAMMING,programming,980263419
7 Easy Ways To Make BUSINESS Faster,business,984610565
 5 Ways You Can Get More MUSIC While Spending Less,Music,880855033
 Take 10 Minutes to Get Started With ZOOLOGY,zoology,185356484
 Now You Can Have The HR MANAGEMENT Of Your Dreams – Cheaper/Faster Than You Ever Imagined,HR management,298141603
 Here Is A Quick Cure For POLITICAL,political,306622787
 There’s Big Money In FASHION DESIGN,Fashion Design,371588682
BUSINESS Strategies For Beginners,business,850421104
Answered: Your Most Burning Questions About GST,GST,387345568
 Top 10 Tips With POLITICAL,political,684626079
 5 Ways OPERATING SYSTEM Will Help You Get More Business,operating system,83380198
 Congratulations! Your GRAPHIC Is (Are) About To Stop Being Relevant,graphic,290105981
 Never Changing OPERATING SYSTEM Will Eventually Destroy You,operating system,545282725
 Boost Your PHOTOGRAPHY With These Tips,photography,453837880
 How To Make Your Product Stand Out With GRAPHIC,graphic,798979125
 Everything You Wanted to Know About HR MANAGEMENT and Were Afraid To Ask,HR management,483015105
 How To Win Clients And Influence Markets with MATHEMATICS,Mathematics,616460346
 How To Take The Headache Out Of BANKING,banking,649711415
 10 Secret Things You Didn't Know About GST,GST,284015922
PHOTOGRAPHY Strategies For Beginners,photography,189561555
PHOTOGRAPHY And Love Have 4 Things In Common,photography,207129840
 How To Learn GRAPHIC,graphic,383609014
DRAWING? It's Easy If You Do It Smart,drawing,699613199
 These 5 Simple PAINTING Tricks Will Pump Up Your Sales Almost Instantly,painting,157075905
 Read This Controversial Article And Find Out More About OPERATING SYSTEM,operating system,485569321
 Find A Quick Way To POLITICS,politics,514879013
12 Questions Answered About DANCE,dance,330552166
 World Class Tools Make MUSIC Push Button Easy,Music,825613035
 Learn To (Do) PHOTOGRAPHY Like A Professional,photography,822351014
 5 Simple Steps To An Effective ART Strategy,art,845077288
 Find A Quick Way To MATHEMATICS,Mathematics,888303493
 Now You Can Have The GRAPHIC Of Your Dreams – Cheaper/Faster Than You Ever Imagined,graphic,262118448
 Short Story: The Truth About HR MANAGEMENT,HR management,422979462
 It's All About (The) OPERATING SYSTEM,operating system,813414175
 2 Ways You Can Use DANCE To Become Irresistible To Customers,dance,216483797
SCIENCE: The Samurai Way,science,688377416
 3 Tips About PROGRAMMING You Can't Afford To Miss,programming,643456648
 What You Should Have Asked Your Teachers About POLITICAL,political,209068015
 Why BUSINESS Succeeds,business,629763492
" If You Want To Be A Winner, Change Your HR MANAGEMENT Philosophy Now!",HR management,496656075
10 Best Practices For BUSINESS,business,687254684
 Want A Thriving Business? Focus On SCIENCE!,science,482013078
A Surprising Tool To Help You GST,GST,914711580
 9 Ways GST Can Make You Invincible,GST,168841100
 3 Things Everyone Knows About BANKING That You Don't,banking,713146418
 5 Things To Do Immediately About PHOTOGRAPHY,photography,728237265
 The Secret Of DANCE,dance,140166055
ART An Incredibly Easy Method That Works For All,art,306201551
 Get Rid of BUSINESS For Good,business,306751185
 These 5 Simple PHOTOGRAPHY Tricks Will Pump Up Your Sales Almost Instantly,photography,558518917
 Use ART To Make Someone Fall In Love With You,art,871739803
OPERATING SYSTEM An Incredibly Easy Method That Works For All,operating system,266056810
 Don't Be Fooled By BANKING,banking,738184745
 OMG! The Best POLITICAL Ever!,political,112648872
 Sexy FASHION DESIGN,Fashion Design,90813722
CRAFT Works Only Under These Conditions,Craft,484949909
 14 Days To A Better BUSINESS,business,600856463
 How To Quit ZOOLOGY In 5 Days,zoology,125175820
 Why Most PROGRAMMING Fail,programming,870287382
 No More Mistakes With FASHION DESIGN,Fashion Design,964927403
 Little Known Ways To Rid Yourself Of CRAFT,Craft,132588989
 22 Tips To Start Building A DANCE You Always Wanted,dance,598176166
 The A - Z Guide Of MATHEMATICS,Mathematics,87886648
 Learn Exactly How I Improved MATHEMATICS In 2 Days,Mathematics,618035113
 What Zombies Can Teach You About GRAPHIC,graphic,605826977
 The Philosophy Of DRAWING,drawing,492905397
 5 Reasons FASHION DESIGN Is A Waste Of Time,Fashion Design,160929994
 The Best Way To PHOTOGRAPHY,photography,58202565
12 Questions Answered About HR MANAGEMENT,HR management,229898008
 7 Ways To Keep Your POLITICAL Growing Without Burning The Midnight Oil,political,978589858
OPERATING SYSTEM And Love - How They Are The Same,operating system,815794757
ZOOLOGY And The Chuck Norris Effect,zoology,42661954
 What Can You Do To Save Your SCIENCE From Destruction By Social Media?,science,324848698
 Take 10 Minutes to Get Started With PHOTOGRAPHY,photography,403170667
 7 and a Half Very Simple Things You Can Do To Save GRAPHIC,graphic,810223923
 How To Start ZOOLOGY With Less Than $100,zoology,705189978
" If You Want To Be A Winner, Change Your DRAWING Philosophy Now!",drawing,41513044
 Ho To (Do) SCIENCE Without Leaving Your Office(House).,science,440935753
 Savvy|Smart|Sexy People Do PROGRAMMING :),programming,826748656
 Some People Excel At ART And Some Don't - Which One Are You?,art,575078752
 Little Known Ways To Rid Yourself Of POLITICAL,political,434469827
 Where Can You Find Free MUSIC Resources,Music,916729154
 How To Win Buyers And Influence Sales with HR MANAGEMENT,HR management,840037981
 Clear And Unbiased Facts About CRAFT (Without All the Hype),Craft,257976183
 What Can Instagramm Teach You About PAINTING,painting,506916578
 Quick and Easy Fix For Your ART,art,736346010
PROGRAMMING Is Crucial To Your Business. Learn Why!,programming,775439526
POLITICS And Love - How They Are The Same,politics,229372647
 Want More Money? Start POLITICS,politics,944040595
POLITICAL Shortcuts - The Easy Way,political,318561875
 The Hidden Mystery Behind GST,GST,376072814
 Interesting Facts I Bet You Never Knew About GST,GST,162807154
 How To Make More ZOOLOGY By Doing Less,zoology,780238133
 How To Win Clients And Influence Markets with PAINTING,painting,596539444
 Remarkable Website - ZOOLOGY Will Help You Get There,zoology,686877958
 11 Methods Of SCIENCE Domination,science,808645616
 3 Mistakes In GST That Make You Look Dumb,GST,895675310
 Old School ZOOLOGY,zoology,374925926
 I Don't Want To Spend This Much Time On ZOOLOGY. How About You?,zoology,740389954
ART Strategies For Beginners,art,819762774
 Savvy|Smart|Sexy People Do CRAFT :),Craft,248994848
 Now You Can Buy An App That is Really Made For DANCE,dance,448580120
 The Untold Secret To OPERATING SYSTEM In Less Than Ten Minutes,operating system,708148901
GST Is Crucial To Your Business. Learn Why!,GST,60511851
 How To Start A Business With BUSINESS,business,845386927
 3 Simple Tips For Using PROGRAMMING To Get Ahead Your Competition,programming,384139800
 Rules Not To Follow About GST,GST,531540967
The Ultimate Guide To ART,art,182156953
 Can You Really Find OPERATING SYSTEM (on the Web)?,operating system,463932574
 9 Ridiculous Rules About MUSIC,Music,577671145
 How To Save Money with MUSIC?,Music,962372987
 Why You Really Need (A) OPERATING SYSTEM,operating system,997139526
 How DANCE Made Me A Better Salesperson,dance,113219198
 Why Most HR MANAGEMENT Fail,HR management,275997198
 How To Turn Your CRAFT From Zero To Hero,Craft,208428215
DRAWING Shortcuts - The Easy Way,drawing,486351463
 Don't Be Fooled By ART,art,352111796
POLITICS And Love Have 4 Things In Common,politics,588239591
 The Secrets To PROGRAMMING,programming,833442120
 The BUSINESS That Wins Customers,business,795416309
HR MANAGEMENT: An Incredibly Easy Method That Works For All,HR management,515124849
 World Class Tools Make DRAWING Push Button Easy,drawing,722885880
 How To Teach BANKING Like A Pro,banking,407350911
12 Questions Answered About MATHEMATICS,Mathematics,898302764
 Who Else Wants To Be Successful With POLITICS,politics,424361005
 Who Else Wants To Enjoy OPERATING SYSTEM,operating system,581708271
 Where Is The Best MUSIC?,Music,569742460
 7 and a Half Very Simple Things You Can Do To Save HR MANAGEMENT,HR management,657085351
 What Your Customers Really Think About Your MUSIC?,Music,224998604
 Top 3 Ways To Buy A Used PROGRAMMING,programming,550123182
POLITICAL: What A Mistake!,political,679198848
 The Ultimate Guide To ZOOLOGY,zoology,711395678
 There’s Big Money In PAINTING,painting,84322023
 Why MATHEMATICS Succeeds,Mathematics,656840970
 2 Ways You Can Use SCIENCE To Become Irresistible To Customers,science,785311173
5 Brilliant Ways To Teach Your Audience About ZOOLOGY,zoology,510652768
 Why GRAPHIC Is No Friend To Small Business,graphic,635232830
 Learn To (Do) BUSINESS Like A Professional,business,375887571
 How To Handle Every GRAPHIC Challenge With Ease Using These Tips,graphic,261159548
 Being A Star In Your Industry Is A Matter Of POLITICS,politics,951141580
 Take 10 Minutes to Get Started With DANCE,dance,294338358
 The Single Most Important Thing You Need To Know About MATHEMATICS,Mathematics,857348370
 Do GST Better Than Barack Obama,GST,104923536
 5 Reasons CRAFT Is A Waste Of Time,Craft,189837177
 Old School POLITICS,politics,312837217
 Need More Time? Read These Tips To Eliminate PHOTOGRAPHY,photography,926167145
 Interesting Facts I Bet You Never Knew About OPERATING SYSTEM,operating system,69191427
 Why I Hate ART,art,479856880
 Best GST Android/iPhone Apps,GST,501054142
 This Study Will Perfect Your BANKING: Read Or Miss Out,banking,183974792
 Here Is A Quick Cure For MATHEMATICS,Mathematics,995620623
 Are You Making These MUSIC Mistakes?,Music,606814741
 Learn Exactly How I Improved DRAWING In 2 Days,drawing,988253819
 Don't Be Fooled By CRAFT,Craft,816250803
5 Brilliant Ways To Use BANKING,banking,282811398
 Why I Hate PAINTING,painting,699000487
 Here's A Quick Way To Solve A Problem with HR MANAGEMENT,HR management,349675800
 Want More Money? Start MUSIC,Music,286244235
12 Questions Answered About FASHION DESIGN,Fashion Design,979382730
 5 Surefire Ways ZOOLOGY Will Drive Your Business Into The Ground,zoology,387174115
 The A - Z Guide Of GST,GST,824146428
 9 Ways POLITICS Can Make You Invincible,politics,478022292
 What Can You Do To Save Your GRAPHIC From Destruction By Social Media?,graphic,140309295
 The Death Of PROGRAMMING And How To Avoid It,programming,649040275
 Proof That ZOOLOGY Really Works,zoology,460042998
 The Quickest & Easiest Way To POLITICAL,political,911882981
 The Hidden Mystery Behind FASHION DESIGN,Fashion Design,989647836
 To People That Want To Start HR MANAGEMENT But Are Affraid To Get Started,HR management,70648422
 Rules Not To Follow About MATHEMATICS,Mathematics,746360166
PROGRAMMING: What A Mistake!,programming,297926496
 You Can Thank Us Later - 3 Reasons To Stop Thinking About DRAWING,drawing,256283075
 The Best Way To GRAPHIC,graphic,593310917
"At Last, The Secret To GST Is Revealed",GST,324945725
 Proof That POLITICAL Really Works,political,234680129
 Secrets To Getting PHOTOGRAPHY To Complete Tasks Quickly And Efficiently,photography,65852367
 Why I Hate BANKING,banking,256395822
FASHION DESIGN Made Simple - Even Your Kids Can Do It,Fashion Design,793502385
 How To Find The Right FASHION DESIGN For Your Specific Product(Service).,Fashion Design,492130876
 Top 10 Tips To Grow Your BANKING,banking,828768220
 14 Days To A Better ZOOLOGY,zoology,131907955
5 Secrets: How To Use DANCE To Create A Successful Business(Product),dance,288651683
 Do SCIENCE Better Than Barack Obama,science,255121025
 What Can You Do About ART Right Now,art,528935137
5 Brilliant Ways To Teach Your Audience About OPERATING SYSTEM,operating system,615389604
 Could This Report Be The Definitive Answer To Your ZOOLOGY?,zoology,764438468
 How To Win Friends And Influence People with DANCE,dance,788028914
 Where Is The Best BANKING?,banking,490273173
 Use CRAFT To Make Someone Fall In Love With You,Craft,787275059
ZOOLOGY Is Essential For Your Success. Read This To Find Out Why,zoology,370333712
 How To Lose Money With POLITICAL,political,943417184
PAINTING Your Way To Success,painting,386074825
 Why ART Is No Friend To Small Business,art,692427717
" In 10 Minutes, I'll Give You The Truth About ZOOLOGY",zoology,563350004
" At Last, The Secret To MATHEMATICS Is Revealed",Mathematics,233667787
 What Can You Do About BANKING Right Now,banking,446370952
 52 Ways To Avoid PAINTING Burnout,painting,166553608
 Don't Just Sit There! Start ZOOLOGY,zoology,400156991
 5 Simple Steps To An Effective GST Strategy,GST,850916264
 Can You Pass The BANKING Test?,banking,115440046
 To People That Want To Start FASHION DESIGN But Are Affraid To Get Started,Fashion Design,607008741
 How To Start A Business With SCIENCE,science,755603743
 Why DRAWING Is The Only Skill You Really Need,drawing,694855149
ART Works Only Under These Conditions,art,780020628
 Top 10 Tips With ZOOLOGY,zoology,550002121
 Learn Exactly How We Made OPERATING SYSTEM Last Month,operating system,336075850
 The Single Most Important Thing You Need To Know About PAINTING,painting,654560551
 Why I Hate POLITICAL,political,808927469
 Lies And Damn Lies About DRAWING,drawing,971365004
 Avoid The Top 10 Mistakes Made By Beginning CRAFT,Craft,185178685
 The Quickest & Easiest Way To MATHEMATICS,Mathematics,969630947
 Why I Hate PROGRAMMING,programming,132810959
 How To Teach CRAFT Better Than Anyone Else,Craft,352456101
 The Lazy Way To ART,art,277024402
POLITICAL And Love - How They Are The Same,political,570084533
 Read This Controversial Article And Find Out More About MUSIC,Music,367234217
 The Single Most Important Thing You Need To Know About MUSIC,Music,419768581
 Have You Heard? OPERATING SYSTEM Is Your Best Bet To Grow,operating system,687424567
 How To Make Your ART Look Like A Million Bucks,art,498837072
 5 Simple Steps To An Effective ZOOLOGY Strategy,zoology,475174004
 Proof That PHOTOGRAPHY Really Works,photography,472772525
10 Best Practices For MATHEMATICS,Mathematics,661267481
 Why My GST Is Better Than Yours,GST,802920549
 Believe In Your DRAWING Skills But Never Stop Improving,drawing,433301749
ART: The Samurai Way,art,141218425
 5 Problems Everyone Has With FASHION DESIGN – How To Solved Them,Fashion Design,173840560
 How I Improved My OPERATING SYSTEM In One Day,operating system,400627121
 3 Things Everyone Knows About PAINTING That You Don't,painting,786449881
 Could This Report Be The Definitive Answer To Your DRAWING?,drawing,686877587
 The Philosophy Of POLITICS,politics,192241348
 3 Ways To Have (A) More Appealing CRAFT,Craft,744116446
 Want To Step Up Your GST? You Need To Read This First,GST,771735479
"At Last, The Secret To GRAPHIC Is Revealed",graphic,485077533
HR MANAGEMENT Iphone Apps,HR management,748719182
 You Don't Have To Be A Big Corporation To Start PHOTOGRAPHY,photography,735641559
 What Make DANCE Don't Want You To Know,dance,464988313
 Why Some People Almost Always Make/Save Money With DRAWING,drawing,718742325
 3 Tips About MATHEMATICS You Can't Afford To Miss,Mathematics,874539541
 How You Can (Do) PAINTING In 24 Hours Or Less For Free,painting,499799213
GRAPHIC Works Only Under These Conditions,graphic,871966562
ZOOLOGY? It's Easy If You Do It Smart,zoology,677668504
PAINTING Iphone Apps,painting,317803396
3 Easy Ways To Make ART Faster,art,569047070
 5 Things To Do Immediately About DANCE,dance,940005877
 Avoid The Top 10 Mistakes Made By Beginning DANCE,dance,186738335
 3 Simple Tips For Using BUSINESS To Get Ahead Your Competition,business,714708613
 Ho To (Do) MATHEMATICS Without Leaving Your Office(House).,Mathematics,510020265
3 Easy Ways To Make PAINTING Faster,painting,204350932
 How To Improve At POLITICAL In 60 Minutes,political,700779064
 Savvy|Smart|Sexy People Do MATHEMATICS :),Mathematics,919501635
HR MANAGEMENT And The Chuck Norris Effect,HR management,993942126
 The PHOTOGRAPHY Mystery Revealed,photography,177376482
 Why You Never See CRAFT That Actually Works,Craft,251867021
 101 Ideas For PHOTOGRAPHY,photography,833699097
 What Can You Do About MUSIC Right Now,Music,479724610
 How To Start POLITICAL With Less Than $100,political,382017720
 Can You Pass The OPERATING SYSTEM Test?,operating system,609539002
 Best Make MUSIC You Will Read This Year (in 2015),Music,185190439
 Why PROGRAMMING Is The Only Skill You Really Need,programming,46541086
 10 Tips That Will Make You Influential In MATHEMATICS,Mathematics,649938889
" If You Do Not (Do)FASHION DESIGN Now, You Will Hate Yourself Later",Fashion Design,863930940
 What Everyone Must Know About FASHION DESIGN,Fashion Design,417257825
 How To Take The Headache Out Of MATHEMATICS,Mathematics,213574799
 2 Ways You Can Use ART To Become Irresistible To Customers,art,540253342
 Here Is A Method That Is Helping OPERATING SYSTEM,operating system,599068608
 Take The Stress Out Of OPERATING SYSTEM,operating system,252547986
 What Everyone Ought To Know About MUSIC,Music,499468997
 How To Make Your Product Stand Out With POLITICAL,political,986648213
 Never Changing PROGRAMMING Will Eventually Destroy You,programming,834842923
 Learn How To Start PROGRAMMING,programming,861543571
 How To Improve At ART In 60 Minutes,art,126856153
 What Is HR MANAGEMENT and How Does It Work?,HR management,982563554
 Could This Report Be The Definitive Answer To Your SCIENCE?,science,176425494
 3 Things Everyone Knows About PROGRAMMING That You Don't,programming,165465041
 Secrets To Getting OPERATING SYSTEM To Complete Tasks Quickly And Efficiently,operating system,203092519
 You Will Thank Us - 10 Tips About PHOTOGRAPHY You Need To Know,photography,606092023
 Don't Fall For This CRAFT Scam,Craft,431776939
GRAPHIC Adventures,graphic,132266771
 I Don't Want To Spend This Much Time On PHOTOGRAPHY. How About You?,photography,570478792
 5 Ways Of POLITICS That Can Drive You Bankrupt - Fast!,politics,355889612
 How BUSINESS Made Me A Better Salesperson,business,355829272
 Top 25 Quotes On PAINTING,painting,128316069
 The Secrets To BUSINESS,business,531673081
 Have You Heard? GRAPHIC Is Your Best Bet To Grow,graphic,99339333
 7 Ways To Keep Your GRAPHIC Growing Without Burning The Midnight Oil,graphic,135586014
 Listen To Your Customers. They Will Tell You All About POLITICAL,political,799386389
 Should Fixing PROGRAMMING Take 60 Steps?,programming,152771984
 How To Turn Your MUSIC From Zero To Hero,Music,616825454
POLITICAL And Love Have 4 Things In Common,political,235847688
 Guaranteed No Stress MATHEMATICS,Mathematics,459588938
 Best 50 Tips For MUSIC,Music,226127373
 Master (Your) SCIENCE in 5 Minutes A Day ,science,446860726
 Picture Your DANCE On Top. Read This And Make It So,dance,153586063
 Where Is The Best POLITICAL?,political,742242101
 How To Win Clients And Influence Markets with SCIENCE,science,984483395
 Boost Your POLITICAL With These Tips,political,832158168
 How To Improve At GST In 60 Minutes,GST,602822048
 How To Make Your DANCE Look Amazing In 5 Days,dance,207715600
 5 Things To Do Immediately About PROGRAMMING,programming,578358823
 The Secrets To Finding World Class Tools For Your SCIENCE Quickly,science,654578497
 Avoid The Top 10 DANCE Mistakes,dance,910498778
 Learn To (Do) PROGRAMMING Like A Professional,programming,913325572
" Death, DANCE And Taxes",dance,412970097
 Succeed With CRAFT In 24 Hours,Craft,347370095
 Top 25 Quotes On CRAFT,Craft,175403357
 Best Make PROGRAMMING You Will Read This Year (in 2015),programming,981290326
10 Best Practices For GST,GST,187703697
 5 Simple Steps To An Effective FASHION DESIGN Strategy,Fashion Design,124051393
DRAWING - So Simple Even Your Kids Can Do It,drawing,602127550
" If You Do Not (Do)DANCE Now, You Will Hate Yourself Later",dance,680921028
 Wondering How To Make Your DANCE Rock? Read This!,dance,32228795
