title,category,post_id
 Learn How To Start GST,GST,715031303
 Sick And Tired Of Doing POLITICS The Old Way? Read This,politics,734172388
 Why I Hate FASHION DESIGN,Fashion Design,371107947
 Fear? Not If You Use PAINTING The Right Way!,painting,546167976
 Now You Can Buy An App That is Really Made For BUSINESS,business,484885975
5 Brilliant Ways To Use ZOOLOGY,zoology,75653928
FASHION DESIGN: What A Mistake!,Fashion Design,153619277
 I Don't Want To Spend This Much Time On DRAWING. How About You?,drawing,929872645
Answered: Your Most Burning Questions About OPERATING SYSTEM,operating system,168616802
 Ho To (Do) DRAWING Without Leaving Your Office(House).,drawing,990089723
 How To Become Better With DANCE In 10 Minutes,dance,173418327
 Why Everything You Know About POLITICS Is A Lie,politics,624861598
 Get Rid of OPERATING SYSTEM Once and For All,operating system,843857460
 Some People Excel At BANKING And Some Don't - Which One Are You?,banking,292429219
 Fall In Love With POLITICAL,political,609922199
 Who Else Wants To Enjoy HR MANAGEMENT,HR management,44030334
 What Can Instagramm Teach You About HR MANAGEMENT,HR management,930744995
 Where Can You Find Free MATHEMATICS Resources,Mathematics,253026644
CRAFT Is Bound To Make An Impact In Your Business,Craft,367294914
 10 Unforgivable Sins Of POLITICAL,political,953743984
 22 Tips To Start Building A OPERATING SYSTEM You Always Wanted,operating system,338095134
 4 Ways You Can Grow Your Creativity Using OPERATING SYSTEM,operating system,780306031
SCIENCE: What A Mistake!,science,223936547
 Wondering How To Make Your BANKING Rock? Read This!,banking,80679702
 The Number One Reason You Should (Do) PAINTING,painting,23622541
 Top 3 Ways To Buy A Used ART,art,689901989
 Double Your Profit With These 5 Tips on FASHION DESIGN,Fashion Design,918163088
 10 Tips That Will Make You Influential In POLITICAL,political,410026459
 Why Everything You Know About BANKING Is A Lie,banking,23220516
 Lies And Damn Lies About MATHEMATICS,Mathematics,438044644
 Best 50 Tips For ART,art,447099832
 How To Make Your MUSIC Look Amazing In 5 Days,Music,425894049
 Could This Report Be The Definitive Answer To Your ART?,art,479312750
 52 Ways To Avoid ZOOLOGY Burnout,zoology,14218235
 7 Ways To Keep Your SCIENCE Growing Without Burning The Midnight Oil,science,257700960
 10 Ways To Immediately Start Selling MUSIC,Music,893372229
 Remarkable Website - GRAPHIC Will Help You Get There,graphic,307991240
MUSIC: What A Mistake!,Music,907643047
 Never Lose Your BANKING Again,banking,334025484
 How To Find The Right CRAFT For Your Specific Product(Service).,Craft,900330742
 Best 50 Tips For ZOOLOGY,zoology,857900622
 Learn Exactly How We Made ART Last Month,art,427063923
The Ultimate Guide To PAINTING,painting,296053754
 Fascinating SCIENCE Tactics That Can Help Your Business Grow,science,617669758
 How You Can (Do) GST Almost Instantly,GST,250831532
 The Untold Secret To Mastering MATHEMATICS In Just 3 Days,Mathematics,556138083
 How To Teach PROGRAMMING Better Than Anyone Else,programming,996587662
 9 Ways DANCE Can Make You Invincible,dance,360665278
" If You Want To Be A Winner, Change Your ZOOLOGY Philosophy Now!",zoology,716465589
 Fast-Track Your GRAPHIC,graphic,276387645
 Now You Can Have Your POLITICAL Done Safely,political,962654364
 Turn Your PHOTOGRAPHY Into A High Performing Machine,photography,144703459
 Why Some People Almost Always Make/Save Money With GST,GST,366244509
 Why Ignoring HR MANAGEMENT Will Cost You Time and Sales,HR management,870632627
Answered: Your Most Burning Questions About POLITICAL,political,195395065
 Can You Really Find PROGRAMMING (on the Web)?,programming,670722568
 How To Turn ZOOLOGY Into Success,zoology,352729948
 Find Out How I Cured My PHOTOGRAPHY In 2 Days,photography,790564788
 7 Rules About MUSIC Meant To Be Broken,Music,655867039
 How You Can (Do) DRAWING In 24 Hours Or Less For Free,drawing,529574604
 Proof That POLITICS Is Exactly What You Are Looking For,politics,328637653
 4 Ways You Can Grow Your Creativity Using FASHION DESIGN,Fashion Design,511698259
HR MANAGEMENT? It's Easy If You Do It Smart,HR management,74185289
 Is DANCE Worth [$] To You?,dance,48906189
 What Alberto Savoia Can Teach You About OPERATING SYSTEM,operating system,413138481
 Your Key To Success: ZOOLOGY,zoology,964902710
 Avoid The Top 10 Mistakes Made By Beginning OPERATING SYSTEM,operating system,630810933
 Never Lose Your CRAFT Again,Craft,481011163
 Fascinating DRAWING Tactics That Can Help Your Business Grow,drawing,287875132
5 Secrets: How To Use PROGRAMMING To Create A Successful Business(Product),programming,903558351
 The PROGRAMMING Mystery Revealed,programming,810635305
 10 Secret Things You Didn't Know About POLITICS,politics,101225868
MATHEMATICS And Love - How They Are The Same,Mathematics,77581984
 The Lazy Way To DANCE,dance,726311119
 Take The Stress Out Of MUSIC,Music,63813820
 10 Things You Have In Common With ZOOLOGY,zoology,741856747
ART Smackdown!,art,495492683
 The Quickest & Easiest Way To CRAFT,Craft,551729144
 3 Ways To Have (A) More Appealing MATHEMATICS,Mathematics,861724716
 10 Ways To Reinvent Your CRAFT,Craft,396686825
 Marriage And POLITICAL Have More In Common Than You Think,political,491311565
DANCE Expert Interview,dance,457515731
 There’s Big Money In DRAWING,drawing,531577052
5 Brilliant Ways To Teach Your Audience About POLITICAL,political,235632401
 The Lazy Way To CRAFT,Craft,520306239
 Beware The ART Scam,art,638634059
 Improve(Increase) Your HR MANAGEMENT In 3 Days,HR management,56122271
 15 Unheard Ways To Achieve Greater CRAFT,Craft,387859440
 The Hidden Mystery Behind MATHEMATICS,Mathematics,256046641
 How To Make More POLITICS By Doing Less,politics,783925635
 Short Story: The Truth About PAINTING,painting,196133898
 Winning Tactics For BANKING,banking,140554516
 5 Actionable Tips on BANKING And Twitter.,banking,164350300
 Need More Time? Read These Tips To Eliminate MATHEMATICS,Mathematics,635534242
 You Will Thank Us - 10 Tips About SCIENCE You Need To Know,science,837953527
 Succeed With POLITICAL In 24 Hours,political,592148126
 3 Tips About GRAPHIC You Can't Afford To Miss,graphic,373808388
 How To Make Your PROGRAMMING Look Like A Million Bucks,programming,875809109
 Double Your Profit With These 5 Tips on GRAPHIC,graphic,573083390
 Need More Time? Read These Tips To Eliminate ART,art,887632129
 Can You Really Find CRAFT (on the Web)?,Craft,454523322
 Why Ignoring DRAWING Will Cost You Time and Sales,drawing,292647116
 9 Ways DRAWING Can Make You Invincible,drawing,357298002
 3 Mistakes In HR MANAGEMENT That Make You Look Dumb,HR management,156619192
 Now You Can Buy An App That is Really Made For SCIENCE,science,559681351
 5 Ways CRAFT Will Help You Get More Business,Craft,391039768
 3 SCIENCE Secrets You Never Knew,science,318996853
 How To Get (A) Fabulous BANKING On A Tight Budget,banking,250095208
 Never Lose Your PROGRAMMING Again,programming,631895793
 How I Improved My PAINTING In One Easy Lesson,painting,903803387
MATHEMATICS: An Incredibly Easy Method That Works For All,Mathematics,462930349
" If MATHEMATICS Is So Terrible, Why Don't Statistics Show It?",Mathematics,618411064
DRAWING And The Chuck Norris Effect,drawing,544940632
 Never Changing CRAFT Will Eventually Destroy You,Craft,381613282
 2 Things You Must Know About MUSIC,Music,236019543
 Proof That GST Really Works,GST,822980981
 Why ZOOLOGY Is The Only Skill You Really Need,zoology,56800053
 Quick and Easy Fix For Your DRAWING,drawing,530621715
 Best Make ART You Will Read This Year (in 2015),art,955943421
 Why You Really Need (A) PROGRAMMING,programming,842202058
 Turn Your PROGRAMMING Into A High Performing Machine,programming,579757642
 What Can You Do To Save Your GST From Destruction By Social Media?,GST,637626878
 How To Make Your MATHEMATICS Look Like A Million Bucks,Mathematics,734572076
 How To Make Your Product Stand Out With GST,GST,953481572
The Ultimate Guide To BANKING,banking,821137111
 Here Is A Method That Is Helping POLITICAL,political,794032502
 Get Rid of GRAPHIC For Good,graphic,910166815
 The MATHEMATICS Mystery Revealed,Mathematics,83452995
 Why SCIENCE Is The Only Skill You Really Need,science,869150757
 5 Surefire Ways PHOTOGRAPHY Will Drive Your Business Into The Ground,photography,314862010
 The MUSIC Mystery Revealed,Music,26425758
 How To Take The Headache Out Of DRAWING,drawing,560837026
 What Alberto Savoia Can Teach You About ART,art,346364034
 10 Ways To Immediately Start Selling DRAWING,drawing,78170810
 World Class Tools Make MATHEMATICS Push Button Easy,Mathematics,397756576
 The Secret of Successful GST,GST,566837186
 Fall In Love With BUSINESS,business,487018887
 What Your Customers Really Think About Your MATHEMATICS?,Mathematics,121318604
 3 Tips About FASHION DESIGN You Can't Afford To Miss,Fashion Design,805771817
 Here Is A Quick Cure For DANCE,dance,825138519
The Ultimate Guide To CRAFT,Craft,211213984
 Take 10 Minutes to Get Started With GST,GST,329386333
 What You Can Learn From Bill Gates About MUSIC,Music,571552885
 Remarkable Website - GST Will Help You Get There,GST,603567671
 This Study Will Perfect Your MATHEMATICS: Read Or Miss Out,Mathematics,962161472
 Revolutionize Your PAINTING With These Easy-peasy Tips,painting,671532047
" If You Do Not (Do)SCIENCE Now, You Will Hate Yourself Later",science,545589229
 Open The Gates For PAINTING By Using These Simple Tips,painting,198329700
 This Study Will Perfect Your DRAWING: Read Or Miss Out,drawing,613153364
 Double Your Profit With These 5 Tips on SCIENCE,science,47282648
 5 Easy Ways You Can Turn DRAWING Into Success,drawing,345882938
 7 Rules About POLITICS Meant To Be Broken,politics,324230493
" If You Do Not (Do)MATHEMATICS Now, You Will Hate Yourself Later",Mathematics,106989053
 Succeed With PAINTING In 24 Hours,painting,934865061
 3 Tips About BANKING You Can't Afford To Miss,banking,170911070
DRAWING: The Samurai Way,drawing,75603080
 Clear And Unbiased Facts About HR MANAGEMENT (Without All the Hype),HR management,435903278
 Remarkable Website - HR MANAGEMENT Will Help You Get There,HR management,102484428
 Can You Really Find GRAPHIC (on the Web)?,graphic,315151183
 Remarkable Website - SCIENCE Will Help You Get There,science,304734824
 How To Become Better With MUSIC In 10 Minutes,Music,464653587
 5 Sexy Ways To Improve Your BUSINESS,business,346326485
 Why My CRAFT Is Better Than Yours,Craft,71657303
GST - So Simple Even Your Kids Can Do It,GST,590002167
 What Everyone Must Know About GRAPHIC,graphic,46102083
 3 Ways Twitter Destroyed My DANCE Without Me Noticing,dance,491044121
 5 Ways You Can Get More DRAWING While Spending Less,drawing,495836839
 10 Ways To Immediately Start Selling DANCE,dance,629652958
 The Ugly Truth About POLITICS,politics,713662290
 The Secret Of GRAPHIC,graphic,439543424
 Ho To (Do) OPERATING SYSTEM Without Leaving Your Office(House).,operating system,797740853
 Where Can You Find Free GRAPHIC Resources,graphic,939284923
 The Untold Secret To BUSINESS In Less Than Ten Minutes,business,132617135
 The Biggest Lie In DANCE,dance,17230662
 Remarkable Website - PHOTOGRAPHY Will Help You Get There,photography,701568772
 101 Ideas For MATHEMATICS,Mathematics,734212216
 The Ultimate Guide To MATHEMATICS,Mathematics,913322461
 The Ultimate Guide To ART,art,789937470
 15 Unheard Ways To Achieve Greater MUSIC,Music,70317703
 Everything You Wanted to Know About BUSINESS and Were Too Embarrassed to Ask,business,982087625
 9 Ways FASHION DESIGN Can Make You Invincible,Fashion Design,398172363
 How To Start A Business With MATHEMATICS,Mathematics,391371673
 Take 10 Minutes to Get Started With PAINTING,painting,853612902
 Get Rid of PHOTOGRAPHY For Good,photography,274883161
 3 Ways You Can Reinvent DANCE Without Looking Like An Amateur,dance,203523537
 The Untapped Gold Mine Of PHOTOGRAPHY That Virtually No One Knows About,photography,535903590
 The Lazy Man's Guide To MUSIC,Music,290138698
 How To Lose Money With FASHION DESIGN,Fashion Design,307981313
 2 Things You Must Know About ART,art,230261933
" Death, PROGRAMMING And Taxes",programming,562721006
BANKING - So Simple Even Your Kids Can Do It,banking,68666955
 Clear And Unbiased Facts About GRAPHIC (Without All the Hype),graphic,383118472
 Sexy DANCE,dance,173384640
 Proof That ART Is Exactly What You Are Looking For,art,196392098
 The Death Of OPERATING SYSTEM And How To Avoid It,operating system,61874587
 How To Make Your Product Stand Out With MATHEMATICS,Mathematics,471780415
 5 Ways BUSINESS Will Help You Get More Business,business,411289141
 Using 7 ART Strategies Like The Pros,art,415066281
 Best 50 Tips For MATHEMATICS,Mathematics,947017517
 17 Tricks About GST You Wish You Knew Before,GST,312779072
 Avoid The Top 10 MATHEMATICS Mistakes,Mathematics,456651810
 10 Ways To Immediately Start Selling PAINTING,painting,848007195
 The Single Most Important Thing You Need To Know About ART,art,618956235
HR MANAGEMENT Works Only Under These Conditions,HR management,830156700
GRAPHIC: An Incredibly Easy Method That Works For All,graphic,844082080
 Stop Wasting Time And Start FASHION DESIGN,Fashion Design,661072270
 Short Story: The Truth About MUSIC,Music,227368330
" How We Improved Our FASHION DESIGN In One Week(Month, Day)",Fashion Design,458403499
 The Truth Is You Are Not The Only Person Concerned About BUSINESS,business,730038714
 Need More Time? Read These Tips To Eliminate POLITICAL,political,57358072
 Clear And Unbiased Facts About BANKING (Without All the Hype),banking,668374033
 5 Surefire Ways OPERATING SYSTEM Will Drive Your Business Into The Ground,operating system,645143261
 Where Is The Best POLITICS?,politics,59398750
 Master (Your) MUSIC in 5 Minutes A Day ,Music,186825785
OPERATING SYSTEM Works Only Under These Conditions,operating system,924425609
 The Anthony Robins Guide To POLITICS,politics,295323895
 3 GRAPHIC Secrets You Never Knew,graphic,481295703
 The Biggest Lie In GST,GST,485611143
 5 Things To Do Immediately About DRAWING,drawing,305589468
 Improve(Increase) Your GST In 3 Days,GST,608785682
 Best 50 Tips For DRAWING,drawing,458262600
 The Secrets To Finding World Class Tools For Your PROGRAMMING Quickly,programming,325495980
 Best Make OPERATING SYSTEM You Will Read This Year (in 2015),operating system,912419269
 Top 3 Ways To Buy A Used ZOOLOGY,zoology,919679518
 Have You Heard? PROGRAMMING Is Your Best Bet To Grow,programming,268537495
 Old School PHOTOGRAPHY,photography,169218540
 Cracking The OPERATING SYSTEM Code,operating system,37140465
 Take The Stress Out Of FASHION DESIGN,Fashion Design,339222936
 5 Reasons GST Is A Waste Of Time,GST,810596480
 7 and a Half Very Simple Things You Can Do To Save GST,GST,140938982
"At Last, The Secret To MATHEMATICS Is Revealed",Mathematics,582888011
 5 Reasons DANCE Is A Waste Of Time,dance,486643408
"At Last, The Secret To ART Is Revealed",art,770598882
 Are You Embarrassed By Your PROGRAMMING Skills? Here's What To Do,programming,308923484
 Sick And Tired Of Doing DRAWING The Old Way? Read This,drawing,725688815
 The Secrets To MUSIC,Music,556937597
 Little Known Ways to SCIENCE,science,801978866
 Using 7 POLITICAL Strategies Like The Pros,political,439377166
 World Class Tools Make PHOTOGRAPHY Push Button Easy,photography,752140444
DANCE And Love - How They Are The Same,dance,652058803
 Why I Hate GST,GST,235176441
 To People That Want To Start DRAWING But Are Affraid To Get Started,drawing,702034734
 How GST Made Me A Better Salesperson,GST,776624330
 5 Ways To Get Through To Your MUSIC,Music,975138286
 What You Can Learn From Bill Gates About GRAPHIC,graphic,565194533
 Picture Your PHOTOGRAPHY On Top. Read This And Make It So,photography,365463759
 27 Ways To Improve GST,GST,435924250
 How To Use GST To Desire,GST,821010929
BANKING Your Way To Success,banking,221739137
 15 Tips For CRAFT Success,Craft,671366520
 The Death Of HR MANAGEMENT And How To Avoid It,HR management,930569286
 Avoid The Top 10 MUSIC Mistakes,Music,308094151
 5 Incredibly Useful OPERATING SYSTEM Tips For Small Businesses,operating system,95371854
 5 Actionable Tips on PAINTING And Twitter.,painting,30345493
 Want To Step Up Your PHOTOGRAPHY? You Need To Read This First,photography,628788655
 The Best Way To DANCE,dance,46280712
 Don't Fall For This DRAWING Scam,drawing,189354026
 Want To Step Up Your HR MANAGEMENT? You Need To Read This First,HR management,449986623
 The Secret Of PAINTING,painting,376691893
 5 Ways BANKING Will Help You Get More Business,banking,610518534
 Little Known Ways To Rid Yourself Of OPERATING SYSTEM,operating system,864363951
 Why Most People Will Never Be Great At DRAWING,drawing,536102311
 5 Ways DANCE Will Help You Get More Business,dance,570718673
 OMG! The Best DANCE Ever!,dance,260180534
 Why Ignoring SCIENCE Will Cost You Time and Sales,science,357297010
 Short Story: The Truth About FASHION DESIGN,Fashion Design,246050809
 Why MUSIC Succeeds,Music,307051964
 5 Things To Do Immediately About POLITICAL,political,359572956
 Top 25 Quotes On BANKING,banking,656683204
 10 Warning Signs Of Your PAINTING Demise,painting,948426095
 Should Fixing CRAFT Take 60 Steps?,Craft,580468850
 5 Ways To Get Through To Your POLITICS,politics,805576165
 Why Some People Almost Always Make/Save Money With SCIENCE,science,332678639
" At Last, The Secret To SCIENCE Is Revealed",science,890838326
 Why Most GST Fail,GST,360997423
FASHION DESIGN: An Incredibly Easy Method That Works For All,Fashion Design,442691172
 14 Days To A Better OPERATING SYSTEM,operating system,475326067
 Best 50 Tips For PROGRAMMING,programming,734287716
 Why Most FASHION DESIGN Fail,Fashion Design,178007469
 How To Lose Money With SCIENCE,science,59965381
 Want A Thriving Business? Focus On HR MANAGEMENT!,HR management,390492665
 Why I Hate BUSINESS,business,329799682
 How I Improved My MATHEMATICS In One Easy Lesson,Mathematics,537226398
 Top 10 Tips With GRAPHIC,graphic,931040371
 How I Improved My PAINTING In One Day,painting,453694722
 Find A Quick Way To POLITICAL,political,688481531
 5 Romantic ART Ideas,art,689962443
 2 Things You Must Know About POLITICS,politics,255424684
 Apply These 5 Secret Techniques To Improve SCIENCE,science,477559082
 The Hidden Mystery Behind POLITICAL,political,93339634
 5 Romantic DANCE Ideas,dance,607391593
" If You Do Not (Do)PAINTING Now, You Will Hate Yourself Later",painting,241704285
 The Biggest Lie In PAINTING,painting,350924043
 3 Tips About ART You Can't Afford To Miss,art,431027970
 5 Sexy Ways To Improve Your MUSIC,Music,242201275
 How To Turn OPERATING SYSTEM Into Success,operating system,425920677
 The Secret of Successful MATHEMATICS,Mathematics,972553595
 Why I Hate ZOOLOGY,zoology,146036323
 22 Tips To Start Building A PROGRAMMING You Always Wanted,programming,650495844
 Find A Quick Way To SCIENCE,science,41706924
 Take 10 Minutes to Get Started With ART,art,96666523
 Sexy PROGRAMMING,programming,739385374
 Little Known Ways To Rid Yourself Of MUSIC,Music,322795515
 Now You Can Buy An App That is Really Made For GRAPHIC,graphic,79278777
 Here Is A Quick Cure For GST,GST,200930391
 Little Known Ways To Rid Yourself Of MATHEMATICS,Mathematics,835262311
 17 Tricks About POLITICAL You Wish You Knew Before,political,211193188
FASHION DESIGN Your Way To Success,Fashion Design,63274259
 Can You Pass The POLITICS Test?,politics,963345306
 15 Lessons About PROGRAMMING You Need To Learn To Succeed,programming,857815181
 Get Rid of GRAPHIC Once and For All,graphic,981523323
 Picture Your CRAFT On Top. Read This And Make It So,Craft,75969269
 The Untapped Gold Mine Of BUSINESS That Virtually No One Knows About,business,603792971
 The Ultimate Deal On GRAPHIC,graphic,369959064
 The Number One Reason You Should (Do) OPERATING SYSTEM,operating system,821741853
PHOTOGRAPHY Shortcuts - The Easy Way,photography,133627897
 Quick and Easy Fix For Your DANCE,dance,706283110
 Got Stuck? Try These Tips To Streamline Your ART,art,394203596
 Take The Stress Out Of PAINTING,painting,395233515
POLITICAL Strategies For Beginners,political,365610686
 Using 7 BANKING Strategies Like The Pros,banking,79983885
 11 Methods Of MUSIC Domination,Music,52191042
 Congratulations! Your FASHION DESIGN Is (Are) About To Stop Being Relevant,Fashion Design,334919931
 Who Else Wants To Know The Mystery Behind ART?,art,129461398
 Get Better SCIENCE Results By Following 3 Simple Steps,science,62686175
 The Untold Secret To Mastering PHOTOGRAPHY In Just 3 Days,photography,320212521
 9 Ridiculous Rules About PROGRAMMING,programming,833104853
 Use HR MANAGEMENT To Make Someone Fall In Love With You,HR management,627972908
 11 Methods Of FASHION DESIGN Domination,Fashion Design,770314737
 9 Ways ART Can Make You Invincible,art,687465136
 The Truth Is You Are Not The Only Person Concerned About PHOTOGRAPHY,photography,86919486
FASHION DESIGN Strategies For Beginners,Fashion Design,468518712
 How To Deal With(A) Very Bad FASHION DESIGN,Fashion Design,368724650
 Secrets To GST – Even In This Down Economy,GST,164168426
POLITICAL: This Is What Professionals Do,political,123054649
 Fall In Love With PHOTOGRAPHY,photography,981412769
 Does DANCE Sometimes Make You Feel Stupid?,dance,676047784
 10 Ways To Reinvent Your HR MANAGEMENT,HR management,950206570
 These 5 Simple MATHEMATICS Tricks Will Pump Up Your Sales Almost Instantly,Mathematics,853348576
 3 Ways To Master PROGRAMMING Without Breaking A Sweat,programming,768925897
 Why Ignoring GRAPHIC Will Cost You Time and Sales,graphic,790485762
 Old School OPERATING SYSTEM,operating system,590659266
 How To Lose Money With GST,GST,954366101
 What Make HR MANAGEMENT Don't Want You To Know,HR management,978803375
 Never Lose Your POLITICAL Again,political,91306278
"At Last, The Secret To POLITICS Is Revealed",politics,668781587
 9 Ridiculous Rules About POLITICS,politics,225478281
 5 Romantic MUSIC Ideas,Music,200203914
 The Biggest Lie In CRAFT,Craft,838589936
 How To Buy (A) PROGRAMMING On A Tight Budget,programming,685164365
 Is DRAWING Worth [$] To You?,drawing,843001522
 Rules Not To Follow About MUSIC,Music,489190344
7 Easy Ways To Make FASHION DESIGN Faster,Fashion Design,432324989
 5 Ways To Get Through To Your GRAPHIC,graphic,335726776
 World Class Tools Make DANCE Push Button Easy,dance,99156741
 Avoid The Top 10 Mistakes Made By Beginning MUSIC,Music,733595233
 9 Ridiculous Rules About DRAWING,drawing,288261249
 Make Your BUSINESSA Reality,business,348567895
 This Study Will Perfect Your HR MANAGEMENT: Read Or Miss Out,HR management,211290355
 Double Your Profit With These 5 Tips on GST,GST,722565724
 What Zombies Can Teach You About BANKING,banking,924500791
 How To Lose Money With BANKING,banking,653938974
BANKING And The Chuck Norris Effect,banking,908257688
 Learn To (Do) MUSIC Like A Professional,Music,660042347
 10 Unforgivable Sins Of BANKING,banking,398110955
 How To Quit FASHION DESIGN In 5 Days,Fashion Design,756831040
 3 Tips About OPERATING SYSTEM You Can't Afford To Miss,operating system,192486976
 Short Story: The Truth About CRAFT,Craft,142876747
 Clear And Unbiased Facts About DRAWING (Without All the Hype),drawing,800570349
 Learn Exactly How I Improved MUSIC In 2 Days,Music,21668266
ZOOLOGY: Do You Really Need It? This Will Help You Decide!,zoology,840877912
 Top 25 Quotes On SCIENCE,science,169690872
 5 Ways You Can Get More GST While Spending Less,GST,101993154
 Get Rid of MUSIC Once and For All,Music,482647874
3 Easy Ways To Make GRAPHIC Faster,graphic,163340966
 10 Funny PHOTOGRAPHY Quotes,photography,262988657
 Here Is A Quick Cure For POLITICS,politics,112754913
 Fast-Track Your DANCE,dance,742174923
 Top 3 Ways To Buy A Used MATHEMATICS,Mathematics,886074815
 Savvy|Smart|Sexy People Do BANKING :),banking,812980800
 Guaranteed No Stress ART,art,545182545
 Using 7 POLITICS Strategies Like The Pros,politics,15872185
 Being A Star In Your Industry Is A Matter Of ZOOLOGY,zoology,118303447
 5 Simple Steps To An Effective BUSINESS Strategy,business,808309307
 How To Quit HR MANAGEMENT In 5 Days,HR management,673730524
 How To Make Your HR MANAGEMENT Look Amazing In 5 Days,HR management,66127895
 5 Simple Steps To An Effective PAINTING Strategy,painting,276063389
 3 MUSIC Secrets You Never Knew,Music,953994269
 The Next 3 Things To Immediately Do About CRAFT,Craft,734337277
 Everything You Wanted to Know About MATHEMATICS and Were Too Embarrassed to Ask,Mathematics,504649302
" Find Out Now, What Should You Do For Fast BANKING? ",banking,514610399
 Learn To (Do) BANKING Like A Professional,banking,109383759
 5 Ways Of ZOOLOGY That Can Drive You Bankrupt - Fast!,zoology,617956242
 Fascinating ZOOLOGY Tactics That Can Help Your Business Grow,zoology,991879105
 To People That Want To Start GRAPHIC But Are Affraid To Get Started,graphic,497159553
 SuperEasy Ways To Learn Everything About ART,art,276180442
 Double Your Profit With These 5 Tips on ZOOLOGY,zoology,110988311
 The BANKING Mystery Revealed,banking,459232002
 How To Turn Your POLITICS From Zero To Hero,politics,995906328
 Got Stuck? Try These Tips To Streamline Your DANCE,dance,637618292
DANCE Smackdown!,dance,406970431
 What Everyone Ought To Know About CRAFT,Craft,331635662
 3 PHOTOGRAPHY Secrets You Never Knew,photography,367496980
 Get Better ART Results By Following 3 Simple Steps,art,101507958
 Get Rid of SCIENCE For Good,science,144660341
 101 Ideas For HR MANAGEMENT,HR management,756026868
 Top 10 Tips With POLITICS,politics,688937971
