title,category,post_id
 How To Deal With(A) Very Bad MUSIC,Music,52829431
 The Untold Secret To ART In Less Than Ten Minutes,art,189726580
 These 5 Simple POLITICS Tricks Will Pump Up Your Sales Almost Instantly,politics,419770912
 How To Teach GST Like A Pro,GST,86994350
 27 Ways To Improve POLITICAL,political,182814934
 How To Improve At DRAWING In 60 Minutes,drawing,428901803
 22 Tips To Start Building A BANKING You Always Wanted,banking,823649823
MATHEMATICS And The Chuck Norris Effect,Mathematics,852679402
 Get The Most Out of ART and Facebook,art,63361145
 The OPERATING SYSTEM Mystery Revealed,operating system,916601432
 What You Should Have Asked Your Teachers About POLITICS,politics,743451050
 Little Known Ways to BANKING,banking,994464633
 Fear? Not If You Use GRAPHIC The Right Way!,graphic,795775394
 To People That Want To Start GST But Are Affraid To Get Started,GST,168539053
BANKING An Incredibly Easy Method That Works For All,banking,255917582
" At Last, The Secret To ART Is Revealed",art,409540354
 The Hidden Mystery Behind GRAPHIC,graphic,181398784
 You Can Thank Us Later - 3 Reasons To Stop Thinking About CRAFT,Craft,311618819
DANCE - So Simple Even Your Kids Can Do It,dance,851078392
 A Guide To CRAFT At Any Age,Craft,346283444
 Top 25 Quotes On GST,GST,525660653
 How PAINTING Made Me A Better Salesperson,painting,539001484
5 Secrets: How To Use OPERATING SYSTEM To Create A Successful Business(Product),operating system,709984036
 Top 10 Tips With OPERATING SYSTEM,operating system,151931672
 The Ugly Truth About OPERATING SYSTEM,operating system,737441192
 The Ultimate Guide To POLITICAL,political,755658821
 Get The Most Out of POLITICS and Facebook,politics,467750899
 Need More Time? Read These Tips To Eliminate DRAWING,drawing,433848413
 Top 10 Tips With ART,art,753671595
 What Everyone Ought To Know About FASHION DESIGN,Fashion Design,861130729
 The Best Way To FASHION DESIGN,Fashion Design,220384159
 Here Is A Quick Cure For BANKING,banking,237934780
 Fear? Not If You Use GST The Right Way!,GST,822114289
 Want More Money? Start POLITICAL,political,681380018
BANKING Is Bound To Make An Impact In Your Business,banking,567193894
 How To Win Friends And Influence People with BUSINESS,business,891200738
 Everything You Wanted to Know About PAINTING and Were Too Embarrassed to Ask,painting,944161856
 What Make POLITICAL Don't Want You To Know,political,196973558
 15 Tips For SCIENCE Success,science,454450036
 What Your Customers Really Think About Your DANCE?,dance,870491962
 13 Myths About ART,art,796009364
 The Anthony Robins Guide To ZOOLOGY,zoology,361272661
 5 Incredibly Useful GST Tips For Small Businesses,GST,177212285
 What Your Customers Really Think About Your ART?,art,211500377
 The Untold Secret To Mastering FASHION DESIGN In Just 3 Days,Fashion Design,790016981
 Why Most ZOOLOGY Fail,zoology,857848264
 Don't Be Fooled By GRAPHIC,graphic,209407334
 5 Ways Of BUSINESS That Can Drive You Bankrupt - Fast!,business,607047212
 Learn Exactly How We Made DANCE Last Month,dance,124071928
 The Anthony Robins Guide To OPERATING SYSTEM,operating system,733947897
 Why POLITICAL Succeeds,political,745076626
 Learn To (Do) POLITICS Like A Professional,politics,167181205
 Find A Quick Way To GST,GST,455450650
 22 Tips To Start Building A ART You Always Wanted,art,255966690
 Rules Not To Follow About BUSINESS,business,181710585
 Why Most People Will Never Be Great At MATHEMATICS,Mathematics,114684478
 The Anthony Robins Guide To BUSINESS,business,480493722
 World Class Tools Make ZOOLOGY Push Button Easy,zoology,811034635
 Here's A Quick Way To Solve A Problem with POLITICS,politics,888746168
 Get Rid of POLITICAL For Good,political,673472574
 What Can Instagramm Teach You About OPERATING SYSTEM,operating system,567197790
 Lies And Damn Lies About FASHION DESIGN,Fashion Design,761341414
 The Best Way To GST,GST,912091966
 Top 25 Quotes On DANCE,dance,664314367
 Top 3 Ways To Buy A Used OPERATING SYSTEM,operating system,960649727
 Top 3 Ways To Buy A Used HR MANAGEMENT,HR management,469109078
 3 Ways To Master BUSINESS Without Breaking A Sweat,business,116995266
SCIENCE Works Only Under These Conditions,science,911820984
 Here's A Quick Way To Solve A Problem with BUSINESS,business,950087787
POLITICS Your Way To Success,politics,713025279
 Lies And Damn Lies About POLITICAL,political,261362131
" How We Improved Our BANKING In One Week(Month, Day)",banking,402897007
 How To Make Your Product Stand Out With PROGRAMMING,programming,701432909
 5 Reasons OPERATING SYSTEM Is A Waste Of Time,operating system,275969440
" Death, POLITICS And Taxes",politics,900673555
 Don't Fall For This BUSINESS Scam,business,331010632
 How You Can (Do) HR MANAGEMENT Almost Instantly,HR management,352740548
MUSIC Iphone Apps,Music,304687059
 17 Tricks About MUSIC You Wish You Knew Before,Music,232777753
 To People That Want To Start OPERATING SYSTEM But Are Affraid To Get Started,operating system,722919291
 Why BUSINESS Is The Only Skill You Really Need,business,54414515
 How To Handle Every POLITICS Challenge With Ease Using These Tips,politics,13446116
 Take 10 Minutes to Get Started With OPERATING SYSTEM,operating system,28323477
ZOOLOGY Expert Interview,zoology,10812066
 How To Turn CRAFT Into Success,Craft,179177268
 Fall In Love With GST,GST,897929170
 5 Simple Steps To An Effective MUSIC Strategy,Music,613403004
 Apply These 5 Secret Techniques To Improve POLITICS,politics,154581302
 3 Ways Twitter Destroyed My POLITICAL Without Me Noticing,political,175148577
 10 Secret Things You Didn't Know About SCIENCE,science,309173351
CRAFT And Love - How They Are The Same,Craft,382989997
 How To Teach OPERATING SYSTEM Like A Pro,operating system,373228899
 How I Improved My DANCE In One Easy Lesson,dance,189347978
 Can You Really Find POLITICS (on the Web)?,politics,686021328
 The Lazy Way To OPERATING SYSTEM,operating system,785454134
 What You Can Learn From Bill Gates About DRAWING,drawing,223372942
 5 Reasons POLITICAL Is A Waste Of Time,political,961177769
 3 Simple Tips For Using GRAPHIC To Get Ahead Your Competition,graphic,527275918
 How To Teach MATHEMATICS Like A Pro,Mathematics,36257202
 Fear? Not If You Use DANCE The Right Way!,dance,547087312
 Why Ignoring GST Will Cost You Time and Sales,GST,211544167
 How To Start A Business With PHOTOGRAPHY,photography,449428222
 Listen To Your Customers. They Will Tell You All About ART,art,423592068
 10 Things You Have In Common With BANKING,banking,594580235
 Some People Excel At DANCE And Some Don't - Which One Are You?,dance,345396680
 7 Rules About POLITICAL Meant To Be Broken,political,424571012
 It's All About (The) DANCE,dance,426384418
 Cracking The DRAWING Code,drawing,528198026
 15 Lessons About GRAPHIC You Need To Learn To Succeed,graphic,376688190
 5 Ways Of FASHION DESIGN That Can Drive You Bankrupt - Fast!,Fashion Design,495620687
 Why You Really Need (A) GST,GST,908446924
 Where Can You Find Free SCIENCE Resources,science,938122914
 What Everyone Ought To Know About DANCE,dance,241475839
 Here's A Quick Way To Solve A Problem with CRAFT,Craft,376814784
 These 5 Simple ZOOLOGY Tricks Will Pump Up Your Sales Almost Instantly,zoology,430664869
 4 Ways You Can Grow Your Creativity Using POLITICS,politics,264947565
MUSIC Made Simple - Even Your Kids Can Do It,Music,740655095
 4 Ways You Can Grow Your Creativity Using CRAFT,Craft,618103012
 4 Ways You Can Grow Your Creativity Using POLITICAL,political,568190166
 Succeed With DANCE In 24 Hours,dance,279339373
 How To Win Buyers And Influence Sales with GST,GST,571045100
 Guaranteed No Stress MUSIC,Music,589593886
 5 Easy Ways You Can Turn DANCE Into Success,dance,688766240
 How To Start A Business With FASHION DESIGN,Fashion Design,642657332
 The Secret Of OPERATING SYSTEM,operating system,601311790
 22 Tips To Start Building A PAINTING You Always Wanted,painting,849202019
 5 Incredibly Useful DRAWING Tips For Small Businesses,drawing,286844118
 5 Things To Do Immediately About MATHEMATICS,Mathematics,102200863
BUSINESS Made Simple - Even Your Kids Can Do It,business,247692851
 These 5 Simple SCIENCE Tricks Will Pump Up Your Sales Almost Instantly,science,669619649
 Beware The GST Scam,GST,521354553
 The CRAFT That Wins Customers,Craft,54542632
 Master (Your) ZOOLOGY in 5 Minutes A Day ,zoology,59073711
 9 Ways POLITICAL Can Make You Invincible,political,490327868
 Best 50 Tips For FASHION DESIGN,Fashion Design,788944143
 The Next 3 Things To Immediately Do About BANKING,banking,394869910
 Now You Can Have Your SCIENCE Done Safely,science,634694747
" How We Improved Our CRAFT In One Week(Month, Day)",Craft,309020592
 This Study Will Perfect Your MUSIC: Read Or Miss Out,Music,918039127
 Why BUSINESS Is No Friend To Small Business,business,845876214
 What Is OPERATING SYSTEM and How Does It Work?,operating system,582603387
 Warning: These 9 Mistakes Will Destroy Your ART,art,767147504
 What Alberto Savoia Can Teach You About MUSIC,Music,417817269
" Death, CRAFT And Taxes",Craft,564457234
 Here Is What You Should Do For Your GRAPHIC,graphic,691367691
 How I Improved My POLITICS In One Easy Lesson,politics,238015342
 Succeed With GRAPHIC In 24 Hours,graphic,486328523
 Don't Fall For This POLITICS Scam,politics,371698111
 Some People Excel At GST And Some Don't - Which One Are You?,GST,107074969
7 Easy Ways To Make DRAWING Faster,drawing,988703947
 Should Fixing PAINTING Take 60 Steps?,painting,153282665
 Fear? Not If You Use POLITICAL The Right Way!,political,247968006
 How To Win Clients And Influence Markets with GST,GST,483480457
 Using 7 GRAPHIC Strategies Like The Pros,graphic,256252129
 Take 10 Minutes to Get Started With CRAFT,Craft,653532681
 How To Save Money with BUSINESS?,business,709930573
 Use FASHION DESIGN To Make Someone Fall In Love With You,Fashion Design,836997948
 Fast-Track Your MUSIC,Music,937253274
 3 Ways To Master MATHEMATICS Without Breaking A Sweat,Mathematics,491667945
 5 Best Ways To Sell GRAPHIC,graphic,858680953
 Avoid The Top 10 BUSINESS Mistakes,business,93236111
 Remarkable Website - MUSIC Will Help You Get There,Music,794068937
 How To Take The Headache Out Of CRAFT,Craft,168208984
 Rules Not To Follow About DRAWING,drawing,353483402
 How To Turn Your ZOOLOGY From Zero To Hero,zoology,733883110
 The POLITICAL That Wins Customers,political,487163082
 Don't Be Fooled By BUSINESS,business,886826181
 The Death Of POLITICS And How To Avoid It,politics,744217082
" If SCIENCE Is So Terrible, Why Don't Statistics Show It?",science,784582847
 The Lazy Way To SCIENCE,science,277167432
 Using 7 PROGRAMMING Strategies Like The Pros,programming,204654273
POLITICAL: Do You Really Need It? This Will Help You Decide!,political,206414131
 14 Days To A Better ART,art,765895873
 Boost Your MATHEMATICS With These Tips,Mathematics,163227162
 How To Get (A) Fabulous PROGRAMMING On A Tight Budget,programming,588711785
 Want To Step Up Your PROGRAMMING? You Need To Read This First,programming,506703480
 The Untold Secret To Mastering BUSINESS In Just 3 Days,business,16266483
 How DRAWING Made Me A Better Salesperson,drawing,204137007
 Remarkable Website - BUSINESS Will Help You Get There,business,315746375
 You Can Thank Us Later - 3 Reasons To Stop Thinking About PROGRAMMING,programming,982425257
 How To Make Your DRAWING Look Like A Million Bucks,drawing,928972883
 You Don't Have To Be A Big Corporation To Start DRAWING,drawing,131664439
 5 Easy Ways You Can Turn CRAFT Into Success,Craft,391627383
 15 Lessons About POLITICS You Need To Learn To Succeed,politics,498789755
 How To Start HR MANAGEMENT With Less Than $100,HR management,715453979
 The Untapped Gold Mine Of OPERATING SYSTEM That Virtually No One Knows About,operating system,392385928
 14 Days To A Better MATHEMATICS,Mathematics,649911157
 Warning: These 9 Mistakes Will Destroy Your CRAFT,Craft,102200627
 Don't Be Fooled By OPERATING SYSTEM,operating system,401847980
 Believe In Your SCIENCE Skills But Never Stop Improving,science,563088972
 Who Else Wants To Know The Mystery Behind HR MANAGEMENT?,HR management,613927314
 How To Make Your POLITICS Look Like A Million Bucks,politics,994466500
 How To Make Your BANKING Look Like A Million Bucks,banking,149755727
 Everything You Wanted to Know About SCIENCE and Were Too Embarrassed to Ask,science,552913869
 How To Become Better With PROGRAMMING In 10 Minutes,programming,555127805
 Are You Making These GST Mistakes?,GST,839665879
 Got Stuck? Try These Tips To Streamline Your POLITICAL,political,712376577
 The Philosophy Of BUSINESS,business,620959516
 What Is MUSIC and How Does It Work?,Music,915960415
 The Death Of CRAFT And How To Avoid It,Craft,86038830
 Succeed With OPERATING SYSTEM In 24 Hours,operating system,822785063
 The Lazy Man's Guide To MATHEMATICS,Mathematics,720941554
 Why Ignoring DANCE Will Cost You Time and Sales,dance,716403119
 Interesting Facts I Bet You Never Knew About MUSIC,Music,521949550
DRAWING Adventures,drawing,42428071
 7 Ways To Keep Your HR MANAGEMENT Growing Without Burning The Midnight Oil,HR management,280522787
 How To Teach SCIENCE Like A Pro,science,603271257
 Little Known Ways to FASHION DESIGN,Fashion Design,929528306
 How To Win Buyers And Influence Sales with ART,art,770882387
 How To Make Your PROGRAMMING Look Amazing In 5 Days,programming,449245721
OPERATING SYSTEM Adventures,operating system,505141995
 The Hidden Mystery Behind CRAFT,Craft,223242576
 Some People Excel At SCIENCE And Some Don't - Which One Are You?,science,214606645
 Best HR MANAGEMENT Android/iPhone Apps,HR management,535947293
POLITICAL Is Essential For Your Success. Read This To Find Out Why,political,390643682
 Could This Report Be The Definitive Answer To Your PHOTOGRAPHY?,photography,48303147
 14 Days To A Better POLITICS,politics,584330621
" If You Do Not (Do)POLITICAL Now, You Will Hate Yourself Later",political,576287180
 7 Rules About PHOTOGRAPHY Meant To Be Broken,photography,922709256
 Winning Tactics For PAINTING,painting,735652426
 You Don't Have To Be A Big Corporation To Start HR MANAGEMENT,HR management,362313790
 How To Win Friends And Influence People with MUSIC,Music,584240943
 5 Simple Steps To An Effective DRAWING Strategy,drawing,784828350
 Never Suffer From BUSINESS Again,business,38409715
 2 Things You Must Know About CRAFT,Craft,49115146
 Sexy ART,art,959736865
 52 Ways To Avoid BUSINESS Burnout,business,228398424
 Quick and Easy Fix For Your PAINTING,painting,150866619
 5 Best Ways To Sell CRAFT,Craft,774344085
MATHEMATICS: What A Mistake!,Mathematics,50168332
OPERATING SYSTEM And Love Have 4 Things In Common,operating system,267536340
" If ART Is So Terrible, Why Don't Statistics Show It?",art,379292053
 The Truth About POLITICAL In 3 Minutes,political,856339917
 How To Turn PHOTOGRAPHY Into Success,photography,329209822
 How To Start ART With Less Than $100,art,28327793
 What Can Instagramm Teach You About PHOTOGRAPHY,photography,590958644
 OMG! The Best FASHION DESIGN Ever!,Fashion Design,847571940
 How To Become Better With PHOTOGRAPHY In 10 Minutes,photography,138925326
 15 Tips For HR MANAGEMENT Success,HR management,971308980
BUSINESS: Do You Really Need It? This Will Help You Decide!,business,995775572
DANCE: The Samurai Way,dance,696452249
 10 Unforgivable Sins Of GST,GST,950825820
 Learn Exactly How We Made SCIENCE Last Month,science,740482599
 5 Things To Do Immediately About CRAFT,Craft,287877098
ZOOLOGY Strategies For Beginners,zoology,955397894
 How To Save Money with PROGRAMMING?,programming,738712064
 52 Ways To Avoid PHOTOGRAPHY Burnout,photography,622184087
 SuperEasy Ways To Learn Everything About GST,GST,913076661
 To People That Want To Start CRAFT But Are Affraid To Get Started,Craft,201670576
 Why Some People Almost Always Make/Save Money With ZOOLOGY,zoology,428068650
 Why You Never See POLITICS That Actually Works,politics,258409333
 Make Your BANKINGA Reality,banking,140040291
 10 Unforgivable Sins Of PHOTOGRAPHY,photography,778554995
 It's All About (The) FASHION DESIGN,Fashion Design,739639919
 Secrets To FASHION DESIGN – Even In This Down Economy,Fashion Design,812919674
GRAPHIC? It's Easy If You Do It Smart,graphic,207552518
 How To Start GST With Less Than $100,GST,993784383
 Read This Controversial Article And Find Out More About SCIENCE,science,458164041
 Turn Your POLITICS Into A High Performing Machine,politics,703278893
 10 Unforgivable Sins Of PROGRAMMING,programming,747325182
 Master (Your) POLITICS in 5 Minutes A Day ,politics,175302376
 Turn Your POLITICAL Into A High Performing Machine,political,842358715
 5 Ways You Can Get More HR MANAGEMENT While Spending Less,HR management,196332272
 Congratulations! Your MATHEMATICS Is (Are) About To Stop Being Relevant,Mathematics,960942491
 Who Else Wants To Know The Mystery Behind FASHION DESIGN?,Fashion Design,253441105
 Find Out How I Cured My OPERATING SYSTEM In 2 Days,operating system,486879074
POLITICAL An Incredibly Easy Method That Works For All,political,823440679
 How To Deal With(A) Very Bad CRAFT,Craft,805863978
 The Biggest Lie In POLITICAL,political,738448844
 How To Sell FASHION DESIGN,Fashion Design,92966039
 Fear? Not If You Use ZOOLOGY The Right Way!,zoology,633941045
 Fascinating BANKING Tactics That Can Help Your Business Grow,banking,520185246
 The DANCE That Wins Customers,dance,805655631
 What Make PROGRAMMING Don't Want You To Know,programming,673865778
 Avoid The Top 10 FASHION DESIGN Mistakes,Fashion Design,21841968
 How To Teach POLITICS Like A Pro,politics,19759907
 Beware The FASHION DESIGN Scam,Fashion Design,136796638
 Why My DANCE Is Better Than Yours,dance,123015739
 Avoid The Top 10 CRAFT Mistakes,Craft,481313157
 What Everyone Must Know About POLITICS,politics,761646827
 The Untapped Gold Mine Of PAINTING That Virtually No One Knows About,painting,163531684
 Secrets To Getting BUSINESS To Complete Tasks Quickly And Efficiently,business,42674134
 3 DRAWING Secrets You Never Knew,drawing,24896003
 Have You Heard? HR MANAGEMENT Is Your Best Bet To Grow,HR management,723392124
 Quick and Easy Fix For Your PHOTOGRAPHY,photography,623409552
 Best 50 Tips For CRAFT,Craft,121930274
 Cracking The FASHION DESIGN Code,Fashion Design,116903021
 It's All About (The) PAINTING,painting,708613346
 Little Known Ways to POLITICS,politics,425168984
 The Death Of ZOOLOGY And How To Avoid It,zoology,369033572
 What Your Customers Really Think About Your CRAFT?,Craft,55894075
 Here Is A Quick Cure For PHOTOGRAPHY,photography,435991456
 Marriage And CRAFT Have More In Common Than You Think,Craft,602135924
" In 10 Minutes, I'll Give You The Truth About GST",GST,698292776
 Want To Step Up Your POLITICS? You Need To Read This First,politics,406878282
 The Single Most Important Thing You Need To Know About PROGRAMMING,programming,192705176
 5 Problems Everyone Has With POLITICAL – How To Solved Them,political,391905550
5 Secrets: How To Use CRAFT To Create A Successful Business(Product),Craft,208143132
 Never Suffer From PROGRAMMING Again,programming,363353226
GST: What A Mistake!,GST,308449302
 15 Lessons About DANCE You Need To Learn To Succeed,dance,269260169
 Essential FASHION DESIGN Smartphone Apps,Fashion Design,989946813
 The Number One Reason You Should (Do) FASHION DESIGN,Fashion Design,914712717
 Make Your PAINTINGA Reality,painting,572768492
 How I Improved My GST In One Easy Lesson,GST,205149098
 Master (Your) PROGRAMMING in 5 Minutes A Day ,programming,982302775
 17 Tricks About FASHION DESIGN You Wish You Knew Before,Fashion Design,735291550
 The Ultimate Guide To OPERATING SYSTEM,operating system,603560140
 Best 50 Tips For DANCE,dance,851114216
 The Ultimate Deal On DRAWING,drawing,334252011
7 Easy Ways To Make PAINTING Faster,painting,219962210
GST: This Is What Professionals Do,GST,43225827
 Want More Money? Start FASHION DESIGN,Fashion Design,853304905
 Is GRAPHIC Worth [$] To You?,graphic,848831260
 Fascinating OPERATING SYSTEM Tactics That Can Help Your Business Grow,operating system,596196968
 Cracking The GRAPHIC Code,graphic,502058257
 Take 10 Minutes to Get Started With FASHION DESIGN,Fashion Design,579987642
10 Best Practices For PAINTING,painting,51976422
 Get Better CRAFT Results By Following 3 Simple Steps,Craft,526014804
 3 Mistakes In GRAPHIC That Make You Look Dumb,graphic,939169166
3 Easy Ways To Make GST Faster,GST,226063179
 How You Can (Do) GST In 24 Hours Or Less For Free,GST,108342623
 10 Unforgivable Sins Of FASHION DESIGN,Fashion Design,45786820
 Is MUSIC Worth [$] To You?,Music,202225566
 How To Learn PROGRAMMING,programming,14264875
 Why Some People Almost Always Make/Save Money With ART,art,681261106
 The Untold Secret To POLITICAL In Less Than Ten Minutes,political,173887324
 What Can You Do About PROGRAMMING Right Now,programming,631123509
 7 and a Half Very Simple Things You Can Do To Save PAINTING,painting,868856046
 Beware The ZOOLOGY Scam,zoology,574555744
 Take The Stress Out Of DRAWING,drawing,109356415
 Avoid The Top 10 Mistakes Made By Beginning PROGRAMMING,programming,958761536
 How To Get (A) Fabulous BUSINESS On A Tight Budget,business,326727741
 Guaranteed No Stress GST,GST,532478732
 Got Stuck? Try These Tips To Streamline Your GST,GST,324961432
 3 ART Secrets You Never Knew,art,430816693
 3 Tips About DANCE You Can't Afford To Miss,dance,136817148
 What Can You Do To Save Your DANCE From Destruction By Social Media?,dance,631583489
 How To Make Your CRAFT Look Amazing In 5 Days,Craft,505566124
 The Untold Secret To DANCE In Less Than Ten Minutes,dance,72630225
 10 Unforgivable Sins Of BUSINESS,business,786229928
 7 Ways To Keep Your PROGRAMMING Growing Without Burning The Midnight Oil,programming,834302210
 The Ultimate Deal On POLITICS,politics,271741605
OPERATING SYSTEM Smackdown!,operating system,911699679
 Got Stuck? Try These Tips To Streamline Your PHOTOGRAPHY,photography,596111433
 Best DRAWING Android/iPhone Apps,drawing,387648862
 5 Simple Steps To An Effective MATHEMATICS Strategy,Mathematics,926782768
 The Next 3 Things To Immediately Do About HR MANAGEMENT,HR management,650168814
 How To Make Your Product Stand Out With BANKING,banking,480875306
 The Secret Of PROGRAMMING,programming,883928426
 3 Tips About GST You Can't Afford To Miss,GST,540936062
FASHION DESIGN Iphone Apps,Fashion Design,480655346
 5 Ways You Can Get More BUSINESS While Spending Less,business,783311398
 Fascinating PAINTING Tactics That Can Help Your Business Grow,painting,261692512
 3 Ways Create Better PAINTING With The Help Of Your Dog,painting,469252723
 The Truth About OPERATING SYSTEM In 3 Minutes,operating system,881693698
 How To Improve At POLITICS In 60 Minutes,politics,483259152
 Read This Controversial Article And Find Out More About PHOTOGRAPHY,photography,83021517
 Stop Wasting Time And Start BANKING,banking,794895117
 Why Most People Will Never Be Great At ZOOLOGY,zoology,351337856
 Top 3 Ways To Buy A Used BUSINESS,business,269725317
 14 Days To A Better PAINTING,painting,93318988
 Top 3 Ways To Buy A Used CRAFT,Craft,486800608
 The Single Most Important Thing You Need To Know About DANCE,dance,344331523
 How To Start BUSINESS With Less Than $100,business,204863413
 Does SCIENCE Sometimes Make You Feel Stupid?,science,674377396
ART: An Incredibly Easy Method That Works For All,art,276519602
 What You Can Learn From Bill Gates About POLITICS,politics,681819402
" Find Out Now, What Should You Do For Fast POLITICS? ",politics,426773870
 5 Ways You Can Get More OPERATING SYSTEM While Spending Less,operating system,976265938
 Take 10 Minutes to Get Started With BUSINESS,business,829366561
 Have You Heard? GST Is Your Best Bet To Grow,GST,322265256
 3 Ways To Master FASHION DESIGN Without Breaking A Sweat,Fashion Design,433010257
 Never Suffer From POLITICS Again,politics,807122107
HR MANAGEMENT: What A Mistake!,HR management,817850983
 Succeed With MATHEMATICS In 24 Hours,Mathematics,787884525
 5 Ways To Get Through To Your POLITICAL,political,976820145
 Quick and Easy Fix For Your OPERATING SYSTEM,operating system,734386386
 Could This Report Be The Definitive Answer To Your PAINTING?,painting,735081103
 10 Ways To Immediately Start Selling FASHION DESIGN,Fashion Design,732932960
BANKING Works Only Under These Conditions,banking,646614478
POLITICAL: An Incredibly Easy Method That Works For All,political,330588281
 3 Ways Create Better BANKING With The Help Of Your Dog,banking,106030547
 Find A Quick Way To HR MANAGEMENT,HR management,258313084
 15 Tips For DRAWING Success,drawing,491236539
 The Secrets To DANCE,dance,676405509
 How To Teach GRAPHIC Better Than Anyone Else,graphic,953284622
 10 Warning Signs Of Your POLITICS Demise,politics,331791766
 10 Unforgivable Sins Of MUSIC,Music,792280217
 Can You Really Find MATHEMATICS (on the Web)?,Mathematics,499585568
 How To Find The Right DANCE For Your Specific Product(Service).,dance,754276016
 How To Teach MUSIC Better Than Anyone Else,Music,79850581
 Don't Be Fooled By PROGRAMMING,programming,695048250
 3 Mistakes In ART That Make You Look Dumb,art,443821546
 How To Take The Headache Out Of ZOOLOGY,zoology,957801961
 Top 10 Tips To Grow Your BUSINESS,business,432484629
 5 Incredibly Useful BUSINESS Tips For Small Businesses,business,321283589
 Winning Tactics For PHOTOGRAPHY,photography,667693419
 How To Lose Money With CRAFT,Craft,164703340
 The Number One Reason You Should (Do) SCIENCE,science,781647923
 Could This Report Be The Definitive Answer To Your BUSINESS?,business,246112796
 How To Win Buyers And Influence Sales with MUSIC,Music,292543874
