title,category,post_id
 15 Unheard Ways To Achieve Greater BANKING,banking,631056825
 Can You Pass The PHOTOGRAPHY Test?,photography,991040218
 It's All About (The) POLITICS,politics,177775000
 Top 25 Quotes On DRAWING,drawing,312233638
 Don't Fall For This GST Scam,GST,132739146
 The Truth About GST In 3 Minutes,GST,531493107
 Everything You Wanted to Know About PHOTOGRAPHY and Were Too Embarrassed to Ask,photography,781997491
 Secrets To Getting ART To Complete Tasks Quickly And Efficiently,art,365569813
 The Quickest & Easiest Way To OPERATING SYSTEM,operating system,828739971
 7 Ways To Keep Your FASHION DESIGN Growing Without Burning The Midnight Oil,Fashion Design,414104373
 You Will Thank Us - 10 Tips About BUSINESS You Need To Know,business,983474575
 How To Find The Right BUSINESS For Your Specific Product(Service).,business,406616349
 The Secret of Successful PROGRAMMING,programming,131946947
 The Best Way To CRAFT,Craft,775025895
 7 Ways To Keep Your DANCE Growing Without Burning The Midnight Oil,dance,69332462
 Never Suffer From PHOTOGRAPHY Again,photography,206196915
 Wondering How To Make Your MUSIC Rock? Read This!,Music,599509927
 5 Reasons PAINTING Is A Waste Of Time,painting,155010098
 10 Ways To Immediately Start Selling ART,art,61250654
 Get Better POLITICS Results By Following 3 Simple Steps,politics,291218241
 Congratulations! Your GST Is (Are) About To Stop Being Relevant,GST,223534504
 5 Best Ways To Sell ART,art,345463988
 Old School BUSINESS,business,238254714
 Want More Money? Start PROGRAMMING,programming,262543516
 5 Ways ART Will Help You Get More Business,art,650108584
 5 Easy Ways You Can Turn PROGRAMMING Into Success,programming,957528958
 Sick And Tired Of Doing GST The Old Way? Read This,GST,856687008
 Learn To (Do) GRAPHIC Like A Professional,graphic,892400090
 How To Learn FASHION DESIGN,Fashion Design,892681633
 The Philosophy Of SCIENCE,science,577882640
 The Untold Secret To Mastering GRAPHIC In Just 3 Days,graphic,69794915
 Fear? Not If You Use DRAWING The Right Way!,drawing,801742425
 How To Find The Right PHOTOGRAPHY For Your Specific Product(Service).,photography,201967102
 Top 10 Tips With PHOTOGRAPHY,photography,514219186
 Revolutionize Your MATHEMATICS With These Easy-peasy Tips,Mathematics,658594314
GRAPHIC: This Is What Professionals Do,graphic,314051097
PAINTING And Love - How They Are The Same,painting,277062955
 Apply These 5 Secret Techniques To Improve DANCE,dance,802819074
"At Last, The Secret To OPERATING SYSTEM Is Revealed",operating system,778041316
" If You Want To Be A Winner, Change Your SCIENCE Philosophy Now!",science,894296915
 Top 3 Ways To Buy A Used BANKING,banking,488628873
 How To Make Your GRAPHIC Look Like A Million Bucks,graphic,98925226
 These 5 Simple CRAFT Tricks Will Pump Up Your Sales Almost Instantly,Craft,866962744
POLITICS Is Essential For Your Success. Read This To Find Out Why,politics,497742283
 How To Sell POLITICAL,political,969169151
3 Easy Ways To Make BANKING Faster,banking,136923455
 How To Turn POLITICAL Into Success,political,810653076
5 Brilliant Ways To Use FASHION DESIGN,Fashion Design,304150007
 The Quickest & Easiest Way To GRAPHIC,graphic,196511863
 Does BUSINESS Sometimes Make You Feel Stupid?,business,775823628
ART Expert Interview,art,678815018
 13 Myths About PROGRAMMING,programming,752135169
 The Truth About HR MANAGEMENT In 3 Minutes,HR management,248283974
 The Biggest Lie In FASHION DESIGN,Fashion Design,751860179
PAINTING Made Simple - Even Your Kids Can Do It,painting,197457006
 Stop Wasting Time And Start ART,art,124992603
 Learn Exactly How I Improved HR MANAGEMENT In 2 Days,HR management,701776558
 These 5 Simple DANCE Tricks Will Pump Up Your Sales Almost Instantly,dance,198648120
 It's All About (The) BANKING,banking,644899968
 How To Lose Money With OPERATING SYSTEM,operating system,747179703
" Death, ZOOLOGY And Taxes",zoology,121297823
 5 Romantic FASHION DESIGN Ideas,Fashion Design,809678544
 15 Lessons About HR MANAGEMENT You Need To Learn To Succeed,HR management,482176896
 3 Ways To Have (A) More Appealing PHOTOGRAPHY,photography,796688475
 What Can You Do About FASHION DESIGN Right Now,Fashion Design,56130323
 2 Ways You Can Use ZOOLOGY To Become Irresistible To Customers,zoology,504584589
 Read This Controversial Article And Find Out More About GST,GST,439815110
 A Guide To MATHEMATICS At Any Age,Mathematics,258635895
 Winning Tactics For FASHION DESIGN,Fashion Design,743528680
 Find A Quick Way To MUSIC,Music,95758606
 Is ART Worth [$] To You?,art,776644432
 You Don't Have To Be A Big Corporation To Start ART,art,119005886
 Do ART Better Than Barack Obama,art,835890615
 Best 50 Tips For OPERATING SYSTEM,operating system,864350156
 Best 50 Tips For POLITICS,politics,248322316
 Are You Embarrassed By Your PHOTOGRAPHY Skills? Here's What To Do,photography,108650192
 Little Known Ways to GST,GST,440036748
 Why HR MANAGEMENT Succeeds,HR management,764792725
 The Untapped Gold Mine Of CRAFT That Virtually No One Knows About,Craft,122462900
 10 Ways To Reinvent Your POLITICAL,political,561603531
 Congratulations! Your DANCE Is (Are) About To Stop Being Relevant,dance,147575880
A Surprising Tool To Help You POLITICAL,political,351103153
 Who Else Wants To Be Successful With BUSINESS,business,886232280
 9 Ways OPERATING SYSTEM Can Make You Invincible,operating system,837230626
 Could This Report Be The Definitive Answer To Your DANCE?,dance,843537379
 The Hidden Mystery Behind OPERATING SYSTEM,operating system,814667257
Answered: Your Most Burning Questions About BUSINESS,business,539334930
 Why OPERATING SYSTEM Is The Only Skill You Really Need,operating system,601305406
 Don't Be Fooled By MUSIC,Music,178239565
 3 Ways You Can Reinvent PAINTING Without Looking Like An Amateur,painting,653361671
 3 Mistakes In DANCE That Make You Look Dumb,dance,894928557
 Do GRAPHIC Better Than Barack Obama,graphic,513344759
 Proof That BUSINESS Really Works,business,60970877
 World Class Tools Make BANKING Push Button Easy,banking,949357359
 10 Funny MUSIC Quotes,Music,194124784
 The Next 3 Things To Immediately Do About POLITICAL,political,479232853
 Could This Report Be The Definitive Answer To Your MATHEMATICS?,Mathematics,76482730
 27 Ways To Improve PHOTOGRAPHY,photography,145625049
 Should Fixing ART Take 60 Steps?,art,624544906
POLITICS Iphone Apps,politics,827430298
 10 Ways To Immediately Start Selling GRAPHIC,graphic,501247415
 Old School FASHION DESIGN,Fashion Design,918610182
 22 Tips To Start Building A BUSINESS You Always Wanted,business,138016441
 How To Learn HR MANAGEMENT,HR management,220861145
 7 Ways To Keep Your DRAWING Growing Without Burning The Midnight Oil,drawing,241358924
 The Truth About POLITICS In 3 Minutes,politics,56356061
 Never Suffer From POLITICAL Again,political,812130141
 9 Ridiculous Rules About BANKING,banking,636468101
 Learn How To Start DRAWING,drawing,516170657
 Are You Making These DANCE Mistakes?,dance,288462543
 Fall In Love With POLITICS,politics,305958191
 Never Lose Your SCIENCE Again,science,885521846
 3 Ways Twitter Destroyed My MATHEMATICS Without Me Noticing,Mathematics,940799193
 Quick and Easy Fix For Your HR MANAGEMENT,HR management,316462022
 Don't Fall For This SCIENCE Scam,science,871335285
 How To Turn SCIENCE Into Success,science,844648782
 Double Your Profit With These 5 Tips on OPERATING SYSTEM,operating system,141077074
 Get The Most Out of BUSINESS and Facebook,business,114315604
" If GRAPHIC Is So Terrible, Why Don't Statistics Show It?",graphic,580143304
 Who Else Wants To Be Successful With OPERATING SYSTEM,operating system,830674195
 101 Ideas For BUSINESS,business,130392124
 Beware The DANCE Scam,dance,866336122
SCIENCE Iphone Apps,science,545667255
 Warning: These 9 Mistakes Will Destroy Your OPERATING SYSTEM,operating system,70116550
 10 Funny ART Quotes,art,436754978
 3 Ways To Master DANCE Without Breaking A Sweat,dance,771220507
 The Lazy Way To POLITICS,politics,268553491
 3 Ways To Have (A) More Appealing DANCE,dance,353117905
 What You Should Have Asked Your Teachers About SCIENCE,science,710464161
SCIENCE And The Chuck Norris Effect,science,785347933
 Learn Exactly How We Made MUSIC Last Month,Music,333835339
 5 Ways To Get Through To Your CRAFT,Craft,924178429
 You Will Thank Us - 10 Tips About ZOOLOGY You Need To Know,zoology,87000064
 How To Make Your OPERATING SYSTEM Look Amazing In 5 Days,operating system,512471515
 You Will Thank Us - 10 Tips About GRAPHIC You Need To Know,graphic,487872618
 Fear? Not If You Use OPERATING SYSTEM The Right Way!,operating system,810542615
 How To Take The Headache Out Of POLITICAL,political,238065247
 Why BANKING Succeeds,banking,352196548
 Rules Not To Follow About ZOOLOGY,zoology,948617169
 10 Ways To Reinvent Your PROGRAMMING,programming,698581102
 Sick And Tired Of Doing GRAPHIC The Old Way? Read This,graphic,903101894
 How You Can (Do) GRAPHIC Almost Instantly,graphic,903414055
 Now You Can Buy An App That is Really Made For DRAWING,drawing,683781422
 10 Tips That Will Make You Influential In MUSIC,Music,63770422
 14 Days To A Better MUSIC,Music,515052785
 Congratulations! Your MUSIC Is (Are) About To Stop Being Relevant,Music,242716789
 What You Should Have Asked Your Teachers About PHOTOGRAPHY,photography,966599431
 Take 10 Minutes to Get Started With HR MANAGEMENT,HR management,367217053
 5 Easy Ways You Can Turn POLITICS Into Success,politics,869578029
 Do DANCE Better Than Barack Obama,dance,865613958
 Get Rid of FASHION DESIGN For Good,Fashion Design,48124556
 These 5 Simple HR MANAGEMENT Tricks Will Pump Up Your Sales Almost Instantly,HR management,427976303
 10 Tips That Will Make You Influential In ZOOLOGY,zoology,12658113
 Get The Most Out of MUSIC and Facebook,Music,100674090
PROGRAMMING And The Chuck Norris Effect,programming,621744890
BANKING Is Essential For Your Success. Read This To Find Out Why,banking,49072197
 How To Use FASHION DESIGN To Desire,Fashion Design,509645396
 It's All About (The) GST,GST,15440658
 Why You Never See SCIENCE That Actually Works,science,789309734
 Why I Hate OPERATING SYSTEM,operating system,501200876
MATHEMATICS Made Simple - Even Your Kids Can Do It,Mathematics,880958704
 Revolutionize Your DRAWING With These Easy-peasy Tips,drawing,146703441
 Read This Controversial Article And Find Out More About ZOOLOGY,zoology,734750016
 The Anthony Robins Guide To ART,art,353076513
12 Questions Answered About GST,GST,587006950
 Get Rid of DRAWING Once and For All,drawing,445149003
 5 Romantic POLITICAL Ideas,political,158792059
 What Can You Do To Save Your POLITICAL From Destruction By Social Media?,political,966066428
 Here Is A Method That Is Helping PHOTOGRAPHY,photography,174381814
 These 5 Simple BANKING Tricks Will Pump Up Your Sales Almost Instantly,banking,207990909
 Here Is A Quick Cure For ZOOLOGY,zoology,660867347
 Your Key To Success: SCIENCE,science,643704178
 What Everyone Must Know About ZOOLOGY,zoology,912082742
 The Secret Of PHOTOGRAPHY,photography,218764636
" Find Out Now, What Should You Do For Fast MATHEMATICS? ",Mathematics,797682416
 3 Things Everyone Knows About GST That You Don't,GST,97569933
MUSIC Is Crucial To Your Business. Learn Why!,Music,162516652
 How To Make Your Product Stand Out With PAINTING,painting,577173284
 The Biggest Lie In PROGRAMMING,programming,501048305
 Boost Your BUSINESS With These Tips,business,218964484
 Could This Report Be The Definitive Answer To Your GST?,GST,713835376
" Death, DRAWING And Taxes",drawing,632418322
 Lies And Damn Lies About HR MANAGEMENT,HR management,41084549
 What You Can Learn From Bill Gates About PROGRAMMING,programming,724393234
 The Philosophy Of ART,art,540678095
 Everything You Wanted to Know About BANKING and Were Afraid To Ask,banking,720556799
 How GRAPHIC Made Me A Better Salesperson,graphic,122555219
12 Questions Answered About SCIENCE,science,27542082
 Everything You Wanted to Know About MUSIC and Were Too Embarrassed to Ask,Music,533752802
 5 Romantic DRAWING Ideas,drawing,564118217
 What Is MATHEMATICS and How Does It Work?,Mathematics,718443667
 Listen To Your Customers. They Will Tell You All About PHOTOGRAPHY,photography,601231953
 How To Teach POLITICAL Better Than Anyone Else,political,322368265
 How I Improved My PHOTOGRAPHY In One Easy Lesson,photography,114261708
 Best FASHION DESIGN Android/iPhone Apps,Fashion Design,825382491
 No More Mistakes With POLITICAL,political,512660237
 How To Make More PHOTOGRAPHY By Doing Less,photography,971483517
12 Questions Answered About DRAWING,drawing,949596142
 Are You Making These GRAPHIC Mistakes?,graphic,701406021
 The A - Z Guide Of POLITICS,politics,795846615
 3 Simple Tips For Using MUSIC To Get Ahead Your Competition,Music,921205491
 The Untold Secret To FASHION DESIGN In Less Than Ten Minutes,Fashion Design,470346084
 Sick And Tired Of Doing ZOOLOGY The Old Way? Read This,zoology,567443392
 5 Problems Everyone Has With CRAFT – How To Solved Them,Craft,767577844
 10 Secret Things You Didn't Know About CRAFT,Craft,389790389
 5 Actionable Tips on SCIENCE And Twitter.,science,746088028
PROGRAMMING Is Bound To Make An Impact In Your Business,programming,242000650
5 Secrets: How To Use DRAWING To Create A Successful Business(Product),drawing,902949071
 5 Incredibly Useful BANKING Tips For Small Businesses,banking,244714173
 3 Ways Twitter Destroyed My DRAWING Without Me Noticing,drawing,710145924
 3 Things Everyone Knows About GRAPHIC That You Don't,graphic,735934574
 Turn Your PAINTING Into A High Performing Machine,painting,642438017
 The Ultimate Secret Of OPERATING SYSTEM,operating system,916187126
A Surprising Tool To Help You DANCE,dance,815674499
 Where Is The Best CRAFT?,Craft,645512331
 The Next 3 Things To Immediately Do About ZOOLOGY,zoology,962814277
 Can You Really Find DRAWING (on the Web)?,drawing,744412678
 10 Things You Have In Common With PAINTING,painting,993925044
12 Questions Answered About PHOTOGRAPHY,photography,998979852
 7 Rules About PAINTING Meant To Be Broken,painting,678219605
" Find Out Now, What Should You Do For Fast PAINTING? ",painting,72883588
 How I Improved My CRAFT In One Easy Lesson,Craft,158561234
" If You Do Not (Do)GST Now, You Will Hate Yourself Later",GST,57650584
 Avoid The Top 10 Mistakes Made By Beginning PHOTOGRAPHY,photography,553045191
 What Can You Do To Save Your POLITICS From Destruction By Social Media?,politics,681583983
 Guaranteed No Stress ZOOLOGY,zoology,156017327
" In 10 Minutes, I'll Give You The Truth About PAINTING",painting,516896049
 17 Tricks About HR MANAGEMENT You Wish You Knew Before,HR management,659998739
 Succeed With DRAWING In 24 Hours,drawing,320545976
 Guaranteed No Stress DRAWING,drawing,821437997
 The Truth About SCIENCE In 3 Minutes,science,496820377
 The Secrets To Finding World Class Tools For Your PAINTING Quickly,painting,544609895
 The Untapped Gold Mine Of POLITICS That Virtually No One Knows About,politics,865608732
 Want A Thriving Business? Focus On OPERATING SYSTEM!,operating system,838966990
 The Secret Of BUSINESS,business,961617885
 Sick And Tired Of Doing HR MANAGEMENT The Old Way? Read This,HR management,550803609
 13 Myths About POLITICS,politics,960872192
 Believe In Your GRAPHIC Skills But Never Stop Improving,graphic,771347333
 Top 10 Tips To Grow Your POLITICAL,political,500897200
 How To Teach FASHION DESIGN Like A Pro,Fashion Design,919892032
 The Lazy Man's Guide To DRAWING,drawing,921135720
 The HR MANAGEMENT Mystery Revealed,HR management,967726706
 What You Can Learn From Bill Gates About ZOOLOGY,zoology,154449089
 The Best Way To BANKING,banking,385885489
 Essential ZOOLOGY Smartphone Apps,zoology,205497604
 Marriage And SCIENCE Have More In Common Than You Think,science,438361431
 Are You Making These DRAWING Mistakes?,drawing,32693014
 Fall In Love With OPERATING SYSTEM,operating system,509789208
" If You Do Not (Do)HR MANAGEMENT Now, You Will Hate Yourself Later",HR management,539190610
 How I Improved My DRAWING In One Easy Lesson,drawing,468723746
12 Questions Answered About OPERATING SYSTEM,operating system,422121359
 Improve(Increase) Your PROGRAMMING In 3 Days,programming,709657463
 Find A Quick Way To FASHION DESIGN,Fashion Design,187365726
 Read This Controversial Article And Find Out More About DANCE,dance,135990474
 Learn How To Start BUSINESS,business,839484429
The Ultimate Guide To HR MANAGEMENT,HR management,561877943
 The Untold Secret To Mastering DRAWING In Just 3 Days,drawing,185527750
 3 PAINTING Secrets You Never Knew,painting,507799724
 Now You Can Buy An App That is Really Made For BANKING,banking,439961927
BANKING: This Is What Professionals Do,banking,882253233
 Make Your FASHION DESIGNA Reality,Fashion Design,41988685
PROGRAMMING: Do You Really Need It? This Will Help You Decide!,programming,861288709
" Death, OPERATING SYSTEM And Taxes",operating system,475464040
 Little Known Ways To Rid Yourself Of HR MANAGEMENT,HR management,792642436
" If PROGRAMMING Is So Terrible, Why Don't Statistics Show It?",programming,839383404
 The Ugly Truth About HR MANAGEMENT,HR management,10467477
 Open The Gates For DRAWING By Using These Simple Tips,drawing,10109921
 The A - Z Guide Of BUSINESS,business,178707444
" At Last, The Secret To POLITICAL Is Revealed",political,458694436
 The Anthony Robins Guide To GST,GST,562020807
 13 Myths About PAINTING,painting,65384580
 5 Sexy Ways To Improve Your HR MANAGEMENT,HR management,21106694
 Get Rid of MATHEMATICS For Good,Mathematics,237311808
 The Truth Is You Are Not The Only Person Concerned About POLITICAL,political,250393290
 The Ultimate Deal On OPERATING SYSTEM,operating system,348392230
 15 Lessons About DRAWING You Need To Learn To Succeed,drawing,240481689
 The Hidden Mystery Behind SCIENCE,science,407273600
 The Truth Is You Are Not The Only Person Concerned About CRAFT,Craft,879891868
POLITICS And The Chuck Norris Effect,politics,936609766
 What Make GST Don't Want You To Know,GST,460585172
 Top 3 Ways To Buy A Used DANCE,dance,59032877
Answered: Your Most Burning Questions About HR MANAGEMENT,HR management,795047895
 Get Rid of ZOOLOGY Once and For All,zoology,74868239
 3 FASHION DESIGN Secrets You Never Knew,Fashion Design,716123655
 Never Lose Your ART Again,art,581242968
 How To Become Better With SCIENCE In 10 Minutes,science,320958352
" Find Out Now, What Should You Do For Fast OPERATING SYSTEM? ",operating system,761295399
 Can You Really Find FASHION DESIGN (on the Web)?,Fashion Design,254229667
 Why Everything You Know About CRAFT Is A Lie,Craft,667140395
 Top 10 Tips To Grow Your CRAFT,Craft,466650436
 What Is ART and How Does It Work?,art,694054706
 The Untapped Gold Mine Of DRAWING That Virtually No One Knows About,drawing,760846458
 What Is DANCE and How Does It Work?,dance,497744963
 5 Ways Of ART That Can Drive You Bankrupt - Fast!,art,941393261
 Secrets To CRAFT – Even In This Down Economy,Craft,111427205
 How To Start A Business With BANKING,banking,83027447
 Never Lose Your MUSIC Again,Music,108454068
 How To Win Friends And Influence People with ART,art,564343291
 Here Is What You Should Do For Your ZOOLOGY,zoology,732348632
 How I Improved My GRAPHIC In One Easy Lesson,graphic,474185440
 Being A Star In Your Industry Is A Matter Of ART,art,792002845
 How To Make Your PAINTING Look Amazing In 5 Days,painting,453664069
PROGRAMMING Iphone Apps,programming,564994388
 The Next 3 Things To Immediately Do About PROGRAMMING,programming,554423085
 OMG! The Best DRAWING Ever!,drawing,723590510
A Surprising Tool To Help You ZOOLOGY,zoology,611361039
 A Guide To FASHION DESIGN At Any Age,Fashion Design,852447014
 Avoid The Top 10 Mistakes Made By Beginning ZOOLOGY,zoology,625706658
 101 Ideas For POLITICS,politics,727436594
 Why PAINTING Is The Only Skill You Really Need,painting,561022186
 Sexy PAINTING,painting,274783220
 Fast-Track Your BANKING,banking,871627520
 Wondering How To Make Your FASHION DESIGN Rock? Read This!,Fashion Design,89880883
 Don't Just Sit There! Start ART,art,674347600
5 Brilliant Ways To Teach Your Audience About DRAWING,drawing,165068748
 What Your Customers Really Think About Your PHOTOGRAPHY?,photography,292138641
 Why Most People Will Never Be Great At BUSINESS,business,529575986
 5 Ways Of HR MANAGEMENT That Can Drive You Bankrupt - Fast!,HR management,538336661
 How To Deal With(A) Very Bad DRAWING,drawing,332853266
 How To Make More MATHEMATICS By Doing Less,Mathematics,550154824
 The Anthony Robins Guide To DANCE,dance,244828750
 How I Improved My SCIENCE In One Easy Lesson,science,927255127
 Essential PROGRAMMING Smartphone Apps,programming,50584449
 What Everyone Ought To Know About GRAPHIC,graphic,839332069
DANCE Strategies For Beginners,dance,659351152
 14 Days To A Better DRAWING,drawing,594884391
 The Number One Reason You Should (Do) GRAPHIC,graphic,785144425
 How To Find The Right MUSIC For Your Specific Product(Service).,Music,32921556
 Why Some People Almost Always Make/Save Money With FASHION DESIGN,Fashion Design,680922914
 Here Is What You Should Do For Your HR MANAGEMENT,HR management,42428318
 Best DANCE Android/iPhone Apps,dance,788689788
 10 Tips That Will Make You Influential In HR MANAGEMENT,HR management,990844883
 Some People Excel At GRAPHIC And Some Don't - Which One Are You?,graphic,152382065
5 Brilliant Ways To Use MATHEMATICS,Mathematics,700730748
 3 Ways You Can Reinvent PHOTOGRAPHY Without Looking Like An Amateur,photography,801683015
 Who Else Wants To Know The Mystery Behind PAINTING?,painting,985574286
 What Make POLITICS Don't Want You To Know,politics,884806386
 Now You Can Buy An App That is Really Made For PAINTING,painting,84915922
 Get The Most Out of GST and Facebook,GST,558493679
 10 Ways To Reinvent Your PHOTOGRAPHY,photography,676341015
 Here's A Quick Way To Solve A Problem with OPERATING SYSTEM,operating system,144047701
 Here Is A Quick Cure For GRAPHIC,graphic,351930999
PAINTING An Incredibly Easy Method That Works For All,painting,483996220
 7 and a Half Very Simple Things You Can Do To Save POLITICS,politics,154648514
 How To Make More GST By Doing Less,GST,87909325
 Cracking The SCIENCE Code,science,519528189
 How To Turn Your ART From Zero To Hero,art,358666453
" If You Do Not (Do)BUSINESS Now, You Will Hate Yourself Later",business,45965809
 Fast-Track Your DRAWING,drawing,338013047
 SuperEasy Ways To Learn Everything About POLITICS,politics,478984752
 5 Romantic PAINTING Ideas,painting,534817926
 How To Deal With(A) Very Bad GST,GST,402148282
 Remarkable Website - DRAWING Will Help You Get There,drawing,799918598
MUSIC An Incredibly Easy Method That Works For All,Music,640325988
 Now You Can Buy An App That is Really Made For PROGRAMMING,programming,416764435
 Proof That HR MANAGEMENT Really Works,HR management,515049939
 The Secret of BUSINESS,business,713921692
 10 Things You Have In Common With POLITICS,politics,162935739
 Apply These 5 Secret Techniques To Improve GRAPHIC,graphic,440926118
 3 Simple Tips For Using PHOTOGRAPHY To Get Ahead Your Competition,photography,272617007
 Want More Money? Start PAINTING,painting,724741891
 5 Reasons POLITICS Is A Waste Of Time,politics,990168718
 Never Lose Your DANCE Again,dance,80698886
 Believe In Your GST Skills But Never Stop Improving,GST,554091942
 To People That Want To Start ZOOLOGY But Are Affraid To Get Started,zoology,881352296
 Ho To (Do) HR MANAGEMENT Without Leaving Your Office(House).,HR management,409151383
 5 Surefire Ways MATHEMATICS Will Drive Your Business Into The Ground,Mathematics,153019620
 What Everyone Ought To Know About POLITICAL,political,566648697
 Why Most People Will Never Be Great At BANKING,banking,287909993
 10 Ways To Immediately Start Selling SCIENCE,science,847593763
 15 Lessons About SCIENCE You Need To Learn To Succeed,science,556630675
 9 Ridiculous Rules About PAINTING,painting,940797434
 What Your Customers Really Think About Your POLITICAL?,political,274189530
 5 Sexy Ways To Improve Your MATHEMATICS,Mathematics,264419310
 Sexy POLITICS,politics,264315553
 3 BUSINESS Secrets You Never Knew,business,172980246
POLITICS Works Only Under These Conditions,politics,701389562
 Being A Star In Your Industry Is A Matter Of OPERATING SYSTEM,operating system,397719082
 Best ART Android/iPhone Apps,art,829135840
 3 Mistakes In BUSINESS That Make You Look Dumb,business,772356206
 Marriage And FASHION DESIGN Have More In Common Than You Think,Fashion Design,464030751
SCIENCE An Incredibly Easy Method That Works For All,science,475261520
 SuperEasy Ways To Learn Everything About MUSIC,Music,147145710
 Are You Embarrassed By Your DANCE Skills? Here's What To Do,dance,944821027
 Why My PHOTOGRAPHY Is Better Than Yours,photography,61064646
 Here Is A Quick Cure For CRAFT,Craft,413256097
 How I Improved My ART In One Easy Lesson,art,518387597
 Want More Money? Start ART,art,264683267
 Picture Your POLITICS On Top. Read This And Make It So,politics,230475708
 What Make GRAPHIC Don't Want You To Know,graphic,247315307
 3 Simple Tips For Using POLITICAL To Get Ahead Your Competition,political,600250317
 Open The Gates For MUSIC By Using These Simple Tips,Music,103254440
 Get The Most Out of ZOOLOGY and Facebook,zoology,706904236
OPERATING SYSTEM Is Essential For Your Success. Read This To Find Out Why,operating system,933345192
 The Philosophy Of PHOTOGRAPHY,photography,446066825
 Top 3 Ways To Buy A Used POLITICAL,political,925155492
 The Secrets To FASHION DESIGN,Fashion Design,317719855
CRAFT Made Simple - Even Your Kids Can Do It,Craft,740481367
